i did not hear what you said	96
how old are you in 2019	52
siri, call jacob	65
what does idiosyncratic mean	34
initiate a call to robert	65
can you tell me how many vacation days have i taken	91
nix that reservation for 4 at strip house	16
do i have enough gas to get to buffalo	47
is 126 divisible by 8	11
i want assistance with my utility bill	83
tell me about the chase credit card application process	73
thanks for your help	120
what are the review for mcdonald's	102
send me an uber to arrive at 5pm at my house and there will be two people going to scully's downtown	135
after 3 days in the fridge is rice safe to eat	44
does greece currently have any travel alerts in place	132
who tracks my credit score	30
how much time to drive to the closest bank	37
how long does it take a new card to arrive in the mail to me	97
change your accent now	20
talk faster than that	23
i need you to text mickey saying 'can we reschedule	119
can anyone let me know the reason behind my frozen bank account	1
can you find some instructions on how to change my oil	78
next song please	75
i'm out of cleaning supplies, remind me on my list	112
heyo	50
what timezone is the country in	123
what is 87 divided by 4	11
what is the next song on this playlist	75
say my name in a sentence	137
can we stop my bank account	45
i'm sorry please repeat the question	96
what timezone is hanoi in	123
can you speak more slowly	23
on tuesday i will be leaving for tennessee and will not be returning until the twenty ninth, alert my bank of this	133
i need a reminder to order cookies	95
am i able to rollover my 401k	106
read back my day for march 4th 2019	12
where are you from if i may ask	145
will flight dl123 be on time	42
make the male british accent please	20
i want to call you maggie	21
can you set a reminder for me	95
what time is my flight going to land	42
can you play music by the beatles	86
robbie needs to know aboutthis so would you text robbie to let them know	119
how well is the gas mileage while i'm in the city	72
how much spending power is on my discover card	28
please delete my todo list	127
what timezone is london in	123
share my location with apple	110
which timezone contains the city of orlando	123
add games without frontiers to my week 5 playlist	136
what is the square root of 8814	11
are you 16 years old	52
put in an order for more checks	81
w-2 tax form where is it	139
i'd like an appointment at your earliest availability for an oil change	108
fetch the song smells like teen spirit and play it	86
can you remove this event from my calendar	13
please ask me again	96
how many calories are in a bowel of wheaties	14
please say that again	96
can you roll a dice for me	105
where do i locate the routing number for the credit union	107
i'm at a new job and i need to do a 401k rollover, how do i do this	106
did i remember to put eggs on my shopping list	111
i'd like to change the pin number on my visa account	85
when is my flight boarding	42
i'd like you to add oranges to my shopping list	112
how do i cash in credit card points	93
i meant no	76
when was my last oil change	63
i want david to know where i'm at	110
dial the last number that called me	65
what's my federal tax this year	117
i want to know the bofa routing number	107
how many calories are in oreos	14
reserve a table for 3 at andrea's steakhouse around 5pm under the name wheeler	101
i want to find a flight for under 700 on the 4th from denver international to new york international	9
what's your home town	145
i'd like to send steve my location	110
where can i find a page showing my how to change my oil	78
what is the derivative of x squared plus 5	11
what is my insurance coverage	57
scrap reservation at 4 for red robin	16
i have an appointment on the 5th put it on for 5pm	13
alert my bank and tell them that i will be in vermont	133
are you able to switch butter and oil	55
what are the ratings for yardhouse	102
can i increase my credit limit	29
stop syncing with my phone	116
is flight dl123 due to land as schedule	42
what kind of gas is required for this car	48
what is the time zone of china	123
can you give me the carry-on rules for american airlines	19
are butter and oil interchangable	55
i need a timer that is set at 1 hour exactly	122
is there enough in my savings account to get a new tv	6
can you help me change my credit limit	29
where is the closet bus stop to go to downtown dallas	36
i want a block placed on my college fund account immediately	45
how are those mcdonald's reviews looking	102
what is 543 times 344	11
let me know if grub burger takes reservations	0
figure out for me when i ought to change my tires next	124
401k rollover help	106
assist me in getting a new credit card	73
what ingredients do i need for shrimp scampi	56
do you remember when i last got my car looked at	63
is chocolate good for you	77
i want new language	22
can you have your name changed to fred	21
in france do they require socket conveters	87
how many ounces in a cup	69
what's my pnc balance	6
you need to change your language setting to russian please	22
how do you spell umbrella	114
please double check on my reservations for buffalo wild wings at five for the game	26
give me the timezone where vancouver is	123
what is the proper fuel type for my car	48
can you check on the status of my credit card application	3
how many hours of vacation have i saved up	88
are you involved in hobbies	141
can you tell me how many pto days do i have left	88
how do you say hello in mexico	131
i want to change my bank of america account pin number	85
how much fuel do i need to get to buffalo	47
you can remove the field trip from my calendar for march 12, 2019	13
what name is saved for me	137
what kind of oil and how much do i need for my toyota tacoma truck and how do i do it	78
where do i go to look at my credit score	30
say that i am in tulsa, will i be charged even more if i use my card	60
help me book a car rental in austin for april 11th to 13th get me a sedan if possible	17
i'm out of apples, add that to my list	112
i need to know why you declined my card yesterday	18
why are humans on earth	68
can the 401k i have be rolled over	106
what's the date of my next paycheck	84
i would like to try and confirm that i have a reservation at outback for josh	26
tell me an axolotl fact	46
i must procure a car rental for the 10th to the 15th in zimbabwe and i would prefer a bmw	17
do you consider yourself an artificial intelligence being	5
who programmed you	148
suggestions for thai food	67
how soon until my tires will need to be changed	124
tell me the duration it takes to get a new cc	97
was my order delivered	82
please place this track on my driving mix	136
does boston restaurant have favorable reviews	102
what is 13 times 57	11
what would you say is a good german dinner idea	67
please lookup my experion credit score	30
i need to text joe	119
are the review for mcdonald's good or bad	102
please notify my bank that i need more checks	81
is this a song that i dont know	144
did i buy too many donuts recently, like last week	115
tell me what to enter into my gps for my current location	31
is there any traffic on the road i take home from work right now, rt 40	128
what is the present status of my credit card application	3
list all purchases of video games	129
how can i make sure that my credit score does not decrease	53
what time is it in the pacific timezone	121
whats a good chinese dinner suggestion	67
do you work for a different individual	147
report a card lost for me	99
can i take more than one carry on	19
take me out of whisper mode	146
i want the next song played	75
show my gps location to brittany	110
check what's on my calendar for tuesday	12
how many miles away am i from madison square garden	37
please repeat what you said	96
if the dollar worth a lot in country b	39
what day is the next holiday	74
how does the traffic look on my way to work right now	128
please add bananas to my shopping list unless i already did	112
what are you interested in	141
i want to find a round trip flight from denver international to new york international on the 8th to the 16th	9
how is the car tire pressure doing	125
how much gas do i have left	47
how much do i have left to pay on my server and domain	7
when did i change my oil	63
how many calories are in powdered donuts	14
what is the minimum amount due on my cable bill	71
turn up your volume	25
show me all video games purchased	129
whats on my reminder list, read back	94
how do i change my credit limit	29
what	96
has my credit card application processed yet	3
help me reserve a table for 3 at lucky's under the name crystal at 8 pm	101
i want to book a hotel in tampa from may 2 to may 4	10
what rules does southwest have for carry-on luggage	19
what is the gas level in my gas tank	47
accepted	149
is my order here	82
would you skip past this song and just play what comes next	75
contact the bank about fraud activity on my card	98
it seems that my account is blocked and i'm not sure why	1
for under 700 i need a flight from denver international to new york international on the 3rd	9
in seoul, what things can i do	134
can i get a car rental in boise from april 11th to april 13th	17
which time zones does european countries use	123
can you find me an uber and have it here at 7pm	135
i would like to know if you are an artificial intelligence being	5
is an international visa needed for canada	61
talk to me about where im at right now	31
is the bill due this week	8
what do i need to buy	111
where do i find my routing number for my pnc account	107
idk	66
how do i prevent my credit score from dropping	53
order an amazon gift card from amazon in the amount of twenty dollars	80
how many calories are in ice cream	14
what's the funniest thing you've got	118
would you skip this song	75
thank you for your help	120
disconnect from phone	116
can you tell me when i should change my oil	79
could you talk a little faster	23
create a timer that is set to go off after 25 mins	122
what transactions have i accrued buying dog food	129
tell me the meaning of condemnation	34
i think my luggage is stolen	64
what date will it be 5 days from now	33
what is the meaning of word alliance	34
i need to know how long to cook chicken for	27
define monetary for me please	34
what is the time in paris now	121
what is the meaning behind life, do you think	68
what am i listening to right now	144
post the living room lights on	113
i'd like to know if my account's blocked and the reason if so	1
what new credit card should i submit an application for	73
tell me the forecast	140
i want a clean bootup to factory settings	100
what's the clock say	121
i need gas so what should i get	48
how do i rollover my 401k	106
what is on my shopping list	111
set me an alarm right now	2
are there any current travel alerts for brazil	132
what do you think we are on earth for	68
tell me how many much fat is in the hamburger	77
who makes you	148
i need new language	22
can you divide 100 by 20	11
how long is the wait at chipotle	51
please show me how to set up my paycheck for direct deposit to my chase account	35
i need to know what my gps coordinates are	31
can i make an appointment for an oil change	108
tell me who your boss is	147
for flight dl123 what's the status	42
put cancel abc on my calendar for next thursday	13
is it possible for you to read the things on my shopping list	111
how might i go about jump starting a car	62
let my bank know that i am going to tokyo	133
i want to buy an iphone7	80
how much am i being taxed	117
how do i increse my credit limit	29
clear something up, are you a robot	5
i need 200 dollars transferred from my long island savings account to my chase checking	130
so what are my current gps coordinates	31
how many days until i get my payment	84
confirmed	149
i need to reserve a large room or suite for 2 couples for august 15th through august 18th in seattle	10
what's the time	121
how good is my card's apr	4
can you play the song that starts with doo doo doo	86
is my card's apr good	4
when you have free time, what do you do	141
i think i want your name changed to fred	21
do i have toothpaste on my shopping list	111
set a reminder to check the steak	95
i get an error message when i try logging in to capital one that says i'm locked out	1
i need to pay my time warner cable bill	83
i want to hear doctor jokes	118
i want you to set alarms for 2pm and 3pm	2
where is the closest red lobster to my location right now, which is 5th avenue	36
enable whisper mode	146
until next time	49
do i have meetings with anyone today	70
what are your interests	141
please flip coin ai	43
i would like brenda to have my location	110
how do i get to the grocery store by bus	36
do i need an international visa to get into italy	61
roll a 6 sided die and tell me the result	105
i need to know the pin number	85
i need more checks because i am out	81
please send a text to danny saying that i'm running late	119
is my milk safe to drink after being in the refrigerator for a week	44
will pepper work instead of salt	55
can you add a doctor's appointment to friday's calendar	13
when is the next payday	84
rolling over my 401k help	106
when did i last get my car checked	63
i need to apply for a new credit card that will match my needs	73
can you spell the word umbrella for me	114
i was flying out of chicago on american airlines flight ab123 and my luggage is now lost	64
you are correct	149
what is the expiration date of my milk	44
how can i change information on my insurance policy	58
which day is pay day	84
is my apr high	4
i'm out of clorox wipes so will you put that on my shopping list	112
pay my water bill from my chase account please	83
what oil do i need for my honda crv and how do i change it	78
forget reservation at oyster bar for tonight	16
please tell me when is the next holiday here	74
could you translate water into dutch for me	131
how would i go about getting more checks for my western union account	81
mayonaise has been in my fridge for three years, is it still good to eat	44
can you repeat that question	96
let me know how many vacation have i utilized	91
are there decent seafood restaurants in portland	103
can you give me a traffic update for a trip to the grocery store	128
i couldn't say	66
can i travel to south africa without getting a shot	138
can you share my location with roger	110
i need a hotel with good reviews in baltimore	10
what kind of insurance do i have	57
what is the current date	33
please change my account to another one	20
what exactly is my credit limit	28
pull up the nutrional info of a 12 oz coke	77
how much pto have i used so far	91
can you skip this song and go to the next one	75
i need to make a vacation request; how	89
for this car, what kind of gas should i use	48
how much time does it take a new card to get mailed to me	97
that is not factual	76
what amount of gas do i have left	47
how long before my updated cc takes to arrive	97
i want to be called tom	24
what's the timezone over there	123
how late is it now in ourense	121
do you have any dogs or cats	38
please tell me where to get the w2	139
while in tulsa, if i use my card, would i be charged more	60
please stop it	15
will i have enough to get a new roku with my savings account	6
ostensibly when is my flight going to land	42
specify who your boss is	147
true, most definitely	149
whats the minimum payment on my electric bill	71
tell me the title of the song playing	144
what is the process for making a vacation request	89
how do you get your visa card rewards	93
give me a cool fact about puppies	46
can you tell me how much i spent on grocery shopping recently	115
what does my commute look like	128
for the love of all that good change your accent	20
show me a hotel that has good reviews in kansas city	10
what is covered under my insurance	57
agreed	149
what's the minimum due for my electric bill	71
where do i find my w-2 tax form	139
what was the date of my last paycheck	84
sync with my phone	116
recite my to do list	126
do i have any meetings today between 9:30 and 10:30	70
do you have a nickname	143
tell me something interesting about new york state	46
show tracking information on my replacement credit card	97
you must change your language setting to russian	22
my insurance plan is what	57
how old are you as of today	52
send me an uber now for four people and we are going to appleby's downtown	135
did i forget to put protein shakes on my shopping list	111
how many days have i taken off	91
flip coin ai	43
can you tell me how long approximate wait times are at cheesecake factory	51
make me a reservation in tampa from may 2 to may 4	10
my day offs history	91
how do i get to the bus stop on foot	36
i'm striving to find a 2-way flight from jfk to dtw for w to july 3	9
can you give me a chinese meal suggestion	67
i would like to know carry-on information for delta	19
what is the status of my vacation time request	90
what is the correct spelling for malignant	114
help me schedule maintenance for my car	108
when should i change the tires	124
what is the sum of 3, 7, 9, and 24	11
i want your volume louder	25
how can i jump start my car	62
how old were you on your most recent birthday	52
is cleaning the garage on my to do list	126
i broke my card when i bent my wallet	32
tell me your funniest joke	118
where were you born as a kid	145
use the name wheeler to reserve a table for 3 at andrea's steakhouse at 5pm	101
what are the ingredients used in chicken curry	56
how long to wait before dining in restaurant beta	51
what do i do to schedule a meeting	109
start a call to cynthia	65
call aj please	65
i think my luggage is missing	64
i want your volume lowered	25
can you please set up a meeting for 3:00 on wednesday	109
will my debit card go bad any time soon	40
will i need an international visa to go to madagascar	61
please define erection for me	34
what do you have in the way of pets	38
where is the closest park	36
does canada require a visa	61
how do i report fraud on my chase bank card	98
i have a card that was lost i need to report	99
tell me where i should get the w2	139
what's my credit limit	28
i'd like to know when my next day off is	74
what is the best way to keep my credit score from going down	53
do i need to have any shots to visit chile	138
how cold is it in wisconsin today	140
do you remember where i left my cellphone	41
is my tire pressure okay on my car	125
i want you to call me a different name so can you call me charchar	24
what steps do i need to follow to change the oil in my car	78
what is the purpose of existence	68
my car battery died and i need help	62
what kind of plug is used in japan	87
how to cash in visa card rewards	93
do you need shots before going to russia	138
i need laundry to be put on my list of things to do	127
forget reservation at longhorn for 4	16
share my location with steve	110
will i be charged if i use my card in russia	60
i want to report fraudulent activity on my visa	98
will i be charged if i use my card in japan	60
i want you to flip a coin now	43
find a recipe for hamburgers	92
assistance in rolling over my 401k	106
where do i have to be on 12/03/2019	12
find out why i can't log in to my bank of america account	1
look up carry-on rules for american airlines	19
maybe it does	66
tell me the date	33
when will my car need new oil	79
i need to book a reservation for 3 at xenophobe under the name zebee	101
give me a cool fact about new orleans	46
i wonder if it would be possible to switch from apples to grapes	55
hi	50
my utility bill is coming due and i need a loan	83
would i be able to swap apples for grapes	55
please reserve a table for 2 at lucky's under the name melissa at 7 pm	101
call my friend aj	65
at the point when should i get my oil changed straightaway	79
please tell me my meeting schedule	70
you've been a big help	120
i want to know what the routing is for chase	107
i need some good suggestions for peruvian cuisine	67
pocki sticks has how many calories	14
who you work for, please	147
whats the number of pto days i have to my availability	88
how is my name saved	137
what can i get for 10 usd in cad	39
i'd like you to pair with my phone	116
i've forgotten my pin number for my citibank gold account	85
now, i want you to play the next song	75
it was lovely to speak with you, bye bye	49
could you please reserve a table for 6 at lucille's under the name tom at 5pm	101
whisper please	146
can you act and think like a real person	5
what was my income last year	54
is there a reservation available at ruth chris today	101
when is my order coming	82
how much vacation do i have saved	88
i want to change your name to adam	21
i want to call up jan	65
i want to know what the purpose of life is	68
tell me the meaning of life	68
i appreciate you doing that	120
talk to me in a speedier manner from here on out	23
are more than one carry on allowed at klm	19
a pleasure as always to speak with you, bye	49
what appointments do i have on thursday the 14th	12
are you secretly real	5
does your family have any pets	38
what manufactures you	148
is my schedule clear with no meetings with dan today	70
hi what's up	50
who do i contact to order more checks for my td bank account	81
instruct me what to do	126
can you call michelle on the home phone	65
please add what i listen to to my lolla playlist	136
how many of my off days have i run through for the year thus far	91
how long should i cook steak for	27
how do you say hello in japanese	131
how much money have i recently spent on stuff	115
tell me the meaning of hegemony	34
i'd like to book the next availability for an oil change	108
what is the average wait time to be seated for dinner at rouge	51
can you find me my phone	41
is it allow to switch apples to grapes	55
what's that song on the speaker now	144
i need to know favorable reviews about boston restaurant	102
do you know the calorie content of a strip of bacon	14
please put a block on my us bank account immediately	45
what was the date when my car was in the shop	63
will i have to wait a long time to receive my new credit card after i lost my old one	97
what is your age again	52
what's your opinion on the meaning of life	68
adjust the volume to level 4	25
what would the routing number for chase be	107
how high is my spending limit on my wells fargo card	28
what's the traffic like going to central park	128
read all my reminders	94
i need a list of ingredients required to make lamb stew	56
will i need to renew my credit card soon	40
has my purchase been delivered yet	82
what things can i do to increase my credit score	53
what will the traffic be like if i headed out to work right now	128
what hobbies do you have	141
do they use a different plug in brazil	87
how do you make dumplings	92
for the shopping list, order everything	80
where am i on gps	31
hey	50
what is your date of birth	52
was there a problem with my card yesterday	18
how can i order checks for my savings account	81
can you repeat what you said	96
were you made here	145
does one need a visa to go there	61
what would you say is the best meal to have for dinner	67
do you know the deeper meaning of life	68
i need to know how to make a vacation request	89
can you pair with my phone	116
i want to hear what you think life's purpose is about	68
how many calories does two bananas have	14
what creatures do you keep for love	38
i want to know about tourist places for bangkok	134
what sort of jokes do you know	118
i need to know this car's mpg	72
i would like to get today's date	33
tell me please what paean means	34
i want a block placed on my checking account right away	45
i was trying to buy a chainsaw at the tractor store and they said my card was declined	18
can you raise your speaking speed	23
let me hear something funny	118
how much was my last transaction for	129
tell me what today's date is	33
tell me how are you	50
what are the things i wanted to recall	94
what's the chance of rain	140
what do you think life is really about	68
i need you to stop talking	15
look up my fico credit score	30
i am needing the next song to be played	75
how long can i keep chicken in the freezer for before it goes gross	44
what gas does this car take	48
read me some different cat trivia items	46
speak french	22
how many calories are in apples	14
what is 89 divided by 3	11
i need a car rental this week	17
could you tell me the temperature of the ac	113
what electrical plug do they use in the uk	87
what kind of oil do i need for my ford truck and how can i change it	78
will i have to wait long for a table at pietro's this evening	51
i do not think that is proper	76
show me all transactions for current statement	129
i would like to know flight dl123's status	42
i repeat cancel	15
would you please schedule a reservation for 2 at lucky's under the name sam at 7:30pm	101
what is the time in london	121
is rice ok after 3 days in the refrigerator	44
i have no oranges, put them onto my list	112
do you know why my card was declined at target i can't figure out why	18
yes, that is true for sure	149
thanks for helping me out today	120
i'm going to be in canada from october 23rd to november 2nd, so can i let my bank know	133
what is your names	143
what things did i not want to forget	94
what's the status of my vacation days	90
what date is the next day i get paid	84
what day do i need to pay my internet and phone bill by	8
what time of day is it	121
help locate my phone	41
tell me what the interest rate is on my personal loan through chase	59
what kind of information do you know	142
please turn the volume to 4	25
how's the traffic to work	128
switch the pin on my chase account	85
who can i call about my luggage	64
i need to update the pin number of my aaa visa	85
how good are the review for yardhouse	102
which plugs does england use	87
please suggest a chinese meal	67
what time of day is it in london	121
how much have i spent on groceries recently	115
can you tell me how to change my oil	78
what were those things i wanted to remember	94
thanks, i appreciate it	120
will my 401k carryover or not	106
what's my tax rate	117
