do i need a visa if i go there	61
what is the nutritional info for kraft mac 'n' cheese	77
what do i get taxed at my income level	117
direct deposit my paycheck to my capital one account	35
tell me when my mastercard bill should be paid	8
i need to cancel my reservation for 2 at franklin's grille	16
please note that i will be travelling internationally soon	133
the statement is true	149
are there any vegan restaurants in my town	103
what's the mpg of my car	72
in what month does my credit card expire	40
can you help me rent a car in las vegas	17
what is the remaining time until we are at our destination	37
give me kilograms to pounds	69
who you work for	147
when should change oil tell me please	79
tell me the date it will be 5 days from now	33
what's the best restaurant in arizona for pizza	134
can you help me increase my credit limit	29
how healthy is pumpkin pie	77
what did i do with my phone	41
should i a gas refill for my car at the next gas station	47
make me an appointment for a tire check	108
is joey my name	137
was the order delivered	82
what company designed you	148
switch back to factory settings	100
how much have i spent on shoes recently	115
how can i make changes for my insurance policy	58
i need to know what routing number i should use for ally	107
you know the reservation i have on 2:00 friday i confirm it	26
what does my credit card charge for their annual percentage rate	4
cash in my credit card rewards	93
how do you say good bye in french	131
what's the equivalent of 1 cup to pounds	69
pair with phone	116
where are you from oroginally	145
how long does it take to cook hot pockets	27
what was that question again	96
what are you capable of answering	142
how've you been	50
my card was rejected at shakey's and i am wondering why	18
my vehicle needs what kind of fuel	48
how do i check my rewards for my chase card	104
remove my todo list	127
what timezone is honolulu in	123
create a reminder	95
can you tell me how changes on my insurance policy can be made	58
change to a new accent please	20
how much country of canada money would i get for $100	39
could you book me an appointment for an oil change	108
schedule an uber to pick me up at home in an hour	135
tell me when i should change me oil	79
i was just at target and they declined my card and i can't understand why	18
so where do i get the w2 form	139
name a few good steakhouses in chicago	103
i want to hear something hilarious	118
what is the air pressure of my car tires	125
is there a way to increase the limit of my credit to 5000 dollars	29
i need an airline ticket for a round trip flight from philadelphia to atlanta for the dates of june 5 - 8	9
where do i rent a car in las vegas from november 16th to december 16th	17
i need to arrange an appointment to have my car's tires examined	108
shopping list	111
pull up ramen recipes please	92
there's something fishy on my card, report it	98
how long does it take milk to expire	44
i have lost my phone	41
i need you to create a timer	122
i'm telling you this is a true statement	149
what do you go by	143
what plug does colombia use	87
when was the car last services	63
which type of pet would you rather possess, a cat or a dog	38
i just put steaks on the grill remind me to check them at the right time	95
i need a spider fact	46
what does distinguish mean	34
i broke my card trying to do a magic trick	32
can you roll a dice with 8 sides	105
so when should i change the oil	79
check my calendar for march 4th 2019, please	12
do you work for a different person	147
how many weeks of vacation do i have	88
will i get charged extra for using my card while in tulsa	60
who formed thou	148
will my 401k rollover	106
i need to report a stolen card	99
stop calling me charlie and from now on always call me chip	24
add what i listen to to my car ride playlist	136
check my shopping list	111
i forgot my pin number for my credit union bank account, can you help	85
what timezone is paris in	123
do i have more than $100 in my pnc account	6
peace out!	49
where is the closest subway entrance to me to go to brooklyn	36
what is my plan for the day	94
wipe my todo list please	127
whats the policy for delta for carry ons	19
my luggage is lost	64
how long would it take to get to mcdonald's in houston	37
how much money do i make at my job	54
is there much traffic between here and work right now	128
will you please tell me my to do list	126
your name please	143
how do i make shrimp	92
i need leslie to be texted saying have a good day	119
i need kilograms to milligrams	69
can i get some funds to pay my utility bill	83
i need a flight from denver international to new york for under 700 on the 3rd	9
how long until my oil needs to be changed	79
who has the best credit card offering for a college student	73
i was at walmart trying to buy toilet paper and my card got declined	18
is there any danger going to brazil	132
what interest rate am i getting currently from oak bank	59
what's the name of the song playing right now	144
i need to know how much 100 dollars is worth in euros	39
confirm the doors are locked	113
i want you to turn the tv on	113
i enrolled in an insurance plan, what one was it	57
hello	50
share with current location with ben	110
could i get assistance booking a car rental in las vegas	17
help me find the chase routing number	107
how's the traffic looking if i headed to fred meyer	128
i want you to add the song i listen to to my summer playlist	136
engage all the door locks	113
i ran out of bread, order more	80
am i able to make reservations at spago in beverly hills	0
where would my phone be	41
make your name steve	21
how little can i pay towards my car insurance	71
when do i need a new credit card	40
i will require help to take care of my utility bill	83
what is the insurance plan i am enrolled in	57
i need you to flip a coin	43
when do i need to change my motor oil again	79
what is your current age	52
what might i need to do to direct deposit my paycheck	35
ill pass	76
would you play the next song	75
from now on, my name is tom	24
it was lovely to speak with you	49
i need you to act swiftly and freeze all activity on my capital one checking	45
please start the song penny lane	86
is it possible to rollover my 401k	106
how do i do a jump start on my car	62
what did you ask again	96
check to see if i am still booked to be eating at gusto handcrafted pasta & pizza at 6:30 pm	26
i ruined my card when it got washed	32
when my house burned down, so did my card	32
how do i go about getting direct deposit in my usaa account	35
can i ask your name	143
how is the car's tire pressure	125
how much do i have to pay on taxes and cable	7
can i make a change to my credit limit	29
what is my tire pressure	125
tell me flight dl123's statud	42
can you tell me when i ought to switch out my tires	124
if my card was stolen, where do i report it	99
i need to know bank of america's routing	107
how much vacation days have i used	91
does brooklyn have good italian restaurants	103
i need you to turn the tv on now	113
how long does it usually take for a new credit card to come	97
what kind of sockets do the us use	87
what is tuesday's calendar like	12
tell me why my card was declined	18
tell me something interesting about elephants	46
i need you to pair with my phone please	116
i have had farm fresh eggs in the fridge for a few months, are they still okay to ingest	44
did i spend too much dough on donuts last week	115
i prefer to be called jason	24
how do i make changes to my insurance policy	58
put laundry on my chore list	127
may you stop a paymet on my account	45
please initiate a phone call to my boss	65
i am going away and need to rent a car	17
how should i rollover my 401k	106
i really must rent a car out of sky harbor airport from the 3rd to the 5th of february	17
what's my work salary	54
what is the apr on my first bank card account	4
i'm out of toilet paper so will you put that on my shopping list	112
remind me to check the steak	95
how healthy is pecan pie	77
where is the closest target	36
scrap	15
place a hold on my chase money market market account at once	45
what are you suppose to do with a 401k rollover when getting a new job	106
let's skip over this song and listen to the next tune instead	75
how long since i swapped oil	63
everything needs ordered off my list	80
help me change my account	20
could a hotel be booked for me in afghanistan at the zoo for the 10th to the 15th	10
make me a reservation for 5 people at village tavern for the calloways	101
i am saying no	76
how much gas do i need to get to buffalo	47
use my savings account to pay xfinity	83
where i can use credit card points	93
can you flip a coin i pick heads	43
what do you want to call me	137
what kind of questions can you answer	142
how long do i have to pay that bill	8
i want know about carry-on for frontier	19
are there 8pm tables available at texas roadhouse	101
what month does my card stop working	40
on what day, month and year did i get new tires	63
i need help with my 401k rollover because i just got a new job	106
repeat that once more	96
what organization manufactures you	148
i want to hear anything you have that's funny	118
tell me when my credit card from visa expires please	40
will you start a timer for me	122
you have my sincere gratitude	120
how long can i keep beef in the freezer for before it gets nasty	44
what's london's timezone	123
do you know if i can use pepper and not salt	55
send a text to joe	119
what do you think the purpose of life is	68
what do i need to do	126
how do i check my rewards for my old navy card	104
can i get beer within my deposit account	6
is there a reason my card was declined	18
whats the reward balance for my visa	104
suggest a few local eateries in mid price range	103
are there any ubers available for two people i need it to go to the stadium on grand	135
from april to may i will be in america so i need to notify my bank	133
book uber from here to downtown	135
what's the carry on policy for delta	19
i'd like to confirm the 2:00 reservation for friday	26
have the riots in france triggered any alerts for people traveling to there	132
do you know london's timezone	123
tell me why i get an error logging in to my bank account	1
what time am i meeting john	70
help me find somewhere to schedule a check up on my car's tires	108
how can i change your response language	22
i need an uber to come to my work at 5pm for three people going to the cineplex downtown	135
what is the amount of pto have i used	91
i need to know the pin number to my card	85
spell doctor	114
make a quarterly payment on my life insurance premium	83
does my western union card have international transaction fees	60
how much money is in all of my bank accounts	6
what's the due date for spectrum's bill	8
hiya	50
what appointments do i have tomorrow after 1:00pm	12
who or what programmed you, do you know	148
you were made where	145
is my credit good enough to get a new card	30
can i hear the song that starts out doo doo doo	86
my card got dropped in the shredded and i need it replaced	32
tell carl that he sucks	119
what is tuesday like on my calendar	12
should i go to okinawa, does it require an international visa	61
i need a timer set please	122
what's my interest rate with my capital one account	59
can you inform if boston restaurant has good reviews	102
how do i say dinner in spanish	131
check if the doors are locked	113
will you please turn the tv on	113
how many times do i get paid in march	84
what day were you born	52
provide me the name of your boss	147
did i include butter in my shopping list	111
do you know my health benefits	57
change over to the female voice	20
this was a nice chat	49
where is my cellphone	41
see ya!	49
i want to set up direct deposit to my charles schwab account	35
i don't have an answer for that	66
i need an uber ride to come and pick me up now at work	135
my card has a burn on it	32
is there anyway, i can report a suspicious activity on my citi card	98
change over to whisper mode	146
where do i find my w-2 form	139
tell me when my credit card expires	40
can you check what is on my calendar for tuesday	12
what music is this	144
i want to report fraudulent activity on my capital one	98
will i be charged if i use my card in china	60
move two hundred dollars to my chase savings account to my wells fargo checking account	130
what's is the current weather forecast	140
read my shopping list	111
i would like to know when is the next holiday here	74
is anything happening on march 4th 2019	12
get a message to my bank that starting the 14th i'll be in canada	133
i want the volume at level 4	25
i will be telling my bank of my upcoming trip to spain	133
are you an actual live person	5
does the bellagio have any reservations	0
can i put in a pto request for may 1 to may 5	89
does south korea require an international visa	61
read me my meeting schedule	70
please flip the coin	43
i'd like the lights in the garage to be turned on	113
can i start calling you dave	21
what is the status of my credit card application looking like	3
please help me in finding my phone	41
message carl, you suck	119
can you tell me what the limit is on my capital one card	28
tell me where you were created	145
is my tire pressure good	125
not happening	76
what items do i have on my amex card this month	129
pay my dte bill from my checking account please	83
has my request for time off been approved	90
how many days of vacation do i have saved	88
what do you do with your free time	141
what are some ways to raise my credit score	53
could you tell me the fuel type for my car	48
no, that is not correct	76
tell me the points on my delta rewards card	104
how many meetings do i have today	70
what would you suggest having for dinner	67
how is my tire pressure	125
the temperature of the ac, what is it at	113
what's the status on my vacation approval	90
tell me how to change my insurance policy	58
have you heard any great jokes lately	118
can you check and tell me if my tires have enough air	125
where should we eat tonight	103
i want to make pork barbque but do no know how	92
redeem my credit card rewards into my account	93
what is my maurices card's rewards balance	104
give me information on grub burger reservations	0
can you arrange a meeting for 3:00 on wednesday	109
i would like to know the mpg for this car	72
when was the last time my car was worked on	63
can you share my credit score with me	30
let me know how to make a vacation request	89
i'm out of kleenex so will you put that on my shopping list	112
what's my visa cards balance for rewards	104
please set an alarm for me	2
is it possible for a hotel to be booked by you for me in afghanistan at the zoo for the 10th to the 15th	10
hows are ya	50
please set a meeting with nancy at 4 pm	109
tell me the least i can pay	71
show me some options for new credit cards that i can apply for, please	73
how do i get to the bowling alley by foot	36
i need to know if i can put a pto request in for march 10 to march 12	89
do you know any jokes about librarians	118
for going to that country, do i need a visa	61
i want to change your name to sarah	21
what is the name of the insurance plan i am enrolled in	57
what sort of electrical plug do they use in mainland europe	87
how does one apply for a master card	73
apple cider has been in my fridge for four months so can i still drink it	44
i'd like to set a new timer	122
i need you to pair with my phone	116
what's the time in london right now	121
i would like to change your name to fred	21
i need to talk to someone about a fraudulent activity on my card	98
schedule me an appointment to get my tires checked out	108
can you now please go back to the original settings	100
i enjoyed our talk, bye	49
how much do my bills cost this month	7
could you book me a hotel in afghanistan at the zoo for the 10th to the 15th	10
would you please increase the speaker volume	25
how much interest am i getting percentage wise from chase	59
is it necessary to get a shot for travel to india	138
what activities do you enjoy	141
when are my tires due for changing	124
can you put the currently playing track on my zen playlist	136
what are the things that i wanted to keep in mind	94
is chocolate bad for you or good for you	77
is an international visa needed to go to cyprus	61
how's my gas mileage while driving through a city	72
how much money is in my bank accounts	6
i want the volume at 4 please	25
flip a normal coin	43
what are some good southern bbq restaurants in nashville	103
is it possible to make a reservation at sushi king in virginia beach	0
how do i go about applying for a macy's credit card	73
what is the mpg for this car	72
what's a good place to vacation	134
how do i switch to a new insurance plan	58
how many calories are in a ghirardelli sea salt caramel candy	14
can you tell me the number of ounces in a quart	69
i need a block placed right away on my joint checking account	45
show me trivia about cats	46
restore factory settings	100
what are united's carry-on rules	19
what is my schedule like today, any meetings with dan	70
what is there to do in craberra	134
who is your boss by the way	147
book a flight from philadelphia to atlanta on june 5th and returning on june 8th	9
what is the name you would use for me	137
i want to report fraudulent activity on my quicksilver card	98
set an alarm for me please	2
how do i get my rewards from my visa card	93
how long does it take to make pho	27
hey how old are you	52
i'd like to cancel my reservation for 5 at hoss's steak house	16
can you get me a car rental for march 13th to 15th in nyc, and i'd like a convertible if possible	17
how much do i have to pay for my shell gas card bill	7
can you tell me my visa's reward balance	104
is today monday	33
please talk a bit faster	23
what different pets do you have	38
don't let me forget to check the steak	95
show all purchases of video games	129
i want to report fraudulent activity on my discover card	98
how much have i spent lately	115
cancel it	15
i no longer want my reservation for 5 at the loft cancel it please	16
please flip a coin - i call heads	43
what are some good mexican restaurants in indianapolis	103
i'd like to know if my capital one credit card have international transaction fees	60
how long is the wait at buffalo wild wings	51
i ran out of checks and need more ordered	81
how do i get to the train station by bus	36
when do i need to pay my car insurance bill by	8
speak navajo	22
what is my gymboree card's rewards balance	104
how does my name appear	137
how are the reviews for pasta at assagios	102
how long do i need to cook roast for	27
can you play the beatles	86
how can i jump start a car	62
what's the time of arrival on my new credit card	97
what was the date of my last car service	63
give me a cool fact about seattle	46
do i have any meetings coming up with dan	70
do i have graham crackers on my shopping list if not please add it	112
can i ask you all different types of questions	142
please put wash the dog on my list of things to do	127
what is the amount i owe on my phone	7
have i spent too much of my paycheck on donuts lately	115
put on bended knee on my reflection playlist	136
i need the information on how to report a lost card	99
what's the amount due on my vet and vehicle registration bills	7
my card was destroyed when my house burned down and i need a replacement	32
how do i set up direct deposit for my bank of america account	35
what is the meaning of fascism	34
how do i convert a cup to ml	69
go to the credit card site and check if my application has gone through	3
what do i need in order to jump start my car	62
when do i need to change my oil next	79
can you roll a dice with 6 sides	105
i know that the statement is true	149
which was my insurance plan again	57
i need to know how to say hello in france	131
how little can i pay on my phone bill	71
convert my credit card points to cash	93
is it possible for you to schedule a meeting for 3:00 on wednesday	109
i need a suite that can accommodate 3 adults and 1 child in san diego for may 15th, 16th, and 17th	10
i will be visiting america so i will need to let me bank know i will be gone from april to may	133
how much do i need to pay in tax	117
i'm searching for a 2-way flight from yqg to heathrow for w to memorial day	9
could you tell me a good joke	118
who should i apply for a credit card for	73
if i am in tulsa, will i get charged extra if i use my card	60
please tell me the reason for the hold on my bb&t account	1
would you tell me how to say goodbye in france	131
what is my pay	84
tell me the pin number to my card	85
can you multiply 45 by 23	11
what is the weather outside	140
can you tell me, what is the meaning of life	68
where can i locate the routing number for the bank i bank with	107
i lost my card, how do i report it	99
what should i get to make the jamaican patties	56
i owe you one	120
when will my visa expire	40
can you add apples to my shopping list if they aren't already on there	112
tell me how to change my policy	58
book a reservation for 3 at xenophobe under the name zebee	101
i would like to try and confirm that i have a reservation at applebee's for kristen	26
i couldn't say either could be possible	66
i would like to try and confirm that i have a reservation at longhorn for justin	26
can you assist with my utility bill payment	83
great western bank's login screen tells me i'm locked out but not why	1
what is my amazon card's rewards balance	104
what time is it in the pacific standard time	121
how long should i cook roast for	27
my name is nick	24
calculate the amount of gas i currently have	47
i need to change my insurance policy, how	58
i want you to go back to factory settings	100
what routing number does chase use	107
what would wells fargo use as routing	107
is it time for a tire change	124
what's my schedule like for thursday the 14th	12
schedule my meeting with jim at 3pm	109
can you please freeze my account	45
can i hear the beatles	86
i don't know the anwser	66
where do i go to get a form for w2s	139
what is the correct spelling of the word: dessert	114
what is the rate for 500 cad in usd	39
i am in downtown austin where is the nearest airport	36
what will i need to make lasagna	56
what is the amount of calories that scrambled eggs has	14
how are the fried chicken at zippys	102
book a motel in uptown from march 3 to march 4	10
what are some exciting things that are a must do for tourists visiting sedona	134
can you tell me what my federal tax burden is	117
what is the square root of 888	11
where you from	145
how many points have i earned with my chase card	104
if i lose my credit card, will i get a replacement immediately	97
how can i make a change to my credit limit	29
that's a yes	149
take out of my checking 400 dollars and put it into my emergency savings account	130
i need to know when's the next holiday	74
what's the forecast for the day	140
let me know what today's date is	33
does denmark use different sockets	87
if i lost my card how do i report it	99
why was my card declined just now when i tried to buy a jeep at carmax	18
can you tell me how much i need to pay on my bills this month	7
tell me something interesting about dogs	46
let me know when you were made	145
"how can i say ""cancel my order"" in french"	131
yearly salary	54
could my 401k be rolled over	106
i need to set up a reminder for myself	95
give arianna my current location	110
can you ask me that again	96
place an order for bread	80
what kind of fuel should i put in my car	48
i need to know the amount of my income	54
how is my name saved aw	137
what kind of traffic is on hwy 1 going to the downtown area right now	128
is dan aware of any meetings with me today	70
please change my name to tom	24
do i have butter on my list	111
when do i need to change my motor oil next	79
set all doors to locked	113
do you have any ideas on the meaning of life	68
please change the language	22
what's the wait like at chima brazilian steakhouse at this time	51
please use whisper mode	146
does my todo list have vacuuming on it	126
i am camile	24
call alex	65
confirm four for my reservation at fiji	26
how many calories are in oranges	14
tell me why my card was declined at auto zone, why	18
i would like to know if i can put a pto request in for march 19 to march 20	89
give a 6 sided dice a roll for me	105
how do i set up direct deposit for my cefcu account	35
how we stop my account	45
i need to know how many pto days are left	88
get my income amount for me	54
do i have enough gas to take me home	47
change to a different accent	20
please tell me the address of my current location	31
do you know my credit rating number	30
how did my bank account is frozen	1
how do i say good bye in chinese	131
how much is my xfinity cable bill	7
get me flight from philly to atlanta on june 5th i'm coming back june 8th	9
does mexico have any travel alerts i should know about	132
i am going to spain in the future and my bank needs to know this information	133
add this song to travel	136
invalid	76
i want to eat mediterranean fare with at least four stars, near me	103
what are the time zones of russia	123
does bellagio allow you to do reservations	0
i want to put thank you on my playlist called relaxing jams	136
what are your hobbies	141
write a text to kim saying no	119
that's definitely true	149
when am i boarding my flight	42
what's my current credit rating	30
when will my card go rotten	40
what are you capable of doing and answering	142
is my todo list free	126
i'm sorry, i didn't understand what you said	96
i wanna know if my capital one credit card have international transaction fees	60
i want to know what trenchant means	34
my luggage is missing off of american airlines flight ab123 out of chicago	64
what's the name you like to be called	143
does march have a holiday	74
i am here to conform my friday reservation at 2:00	26
is there anything on my todo list for taking out the trash	126
i'm finished with my to do list	127
there is no juice in my battery please help	62
which day is it today	33
