put a device with my phone	116
go ahead and talk faster now	23
no, that is fake	76
how much do i make in a year	54
was i spending too much money on doughnuts last week	115
which insurance do i have	57
could you inform me of when i last got my car checked	63
how do i do a 401k rollover when switching to a new job	106
do i already have cereal on my shopping list	111
what kinds of taxes am i facing	117
are there any active events for march 4th 2019	12
where exactly am i at the moment	31
do you work for a different employer	147
when did i get my check last	84
order all items on the list	80
does going to taiwan require me to get an international visa	61
appreciated	120
i want to call mark	65
which way do you have my name saved	137
set an alarm for four thirty tomorrow, please	2
how much air pressure is in my tires	125
what's the least i can pay towards this bill	71
what's the name i should use to talk to you	143
how do i set up direct deposit for my first national account	35
how do i ask about the weather in chinese	131
is france safe to travel to	132
what do you like to do in your free time	141
in a fried egg, how many calories are there	14
what place were you actually born at	145
can you tell the temperature it will tomorrow	140
whats the procedure to cancel it	15
can you tell me how much pto have i use	91
how many vacation days have i saved up	88
how is doctor spelled	114
i'd like direct deposit to my chase bank account	35
can you place a stop on my account	45
please send me more checkbooks	81
i need your accent to be changed	20
cash in my credit card points	93
you could tell me if you were real	5
do you have a cat or a dog	38
look up uber to downtown	135
what kind of meal should i eat from thailand	67
tell me my name the way its saved	137
what plan am i paying for	57
is it safe to travel to mexico	132
when is my flight going to arrive	42
where is the nearest walmart	36
please order more checks i just used the last one	81
please go ahead and flip a coin	43
tell me when to next change my tires	124
what weight oil do i need and how do i change the oil for my chevy truck	78
i need to know about how much time i'd have to wait to get a table at dibruno's	51
what kind of electrical plug do they use in the uae	87
give me my credit limit	28
i need your volume increased	25
hey what's up	50
let's try whisper mode	146
i need to know the date it will be 4 days from now	33
given a choice would you take a dog or a cat	38
i need to know is traveling to france safe	132
do you have any of the beatles music	86
how bad is my current credit score	30
are you good	50
what kind of gas does my car need	48
what plugs are in england	87
when's the next time i get paid	84
i need to know today's forecast	140
i need to order new checks because i am all out	81
please tell me all the purchases on my hy-vee card for this statement period	129
speed your speech up	23
play the song that goes like i like to move it, move it	86
what is the best thing for me to do to improve my credit score quickly	53
i'm not sure if watermelon is on my shopping list, but if it isn't can you put it on there	112
i need my pin number for my bank of america account and i can't remember it	85
do i need to get any shots before i go to brazil	138
stop please	15
are there any travel alerts for mountain view	132
who do i contact for a w2 form	139
show me a hotel in boise that has positive reviews	10
is there a wait time at bjs right now	51
what are some good vegan restaurants in broadripple	103
what kind of questions can i ask the ai	142
remind me to get an oil change	95
my vacation to spain is coming up and i need my bank to know	133
please roll this 8 sided dice	105
what do i do if my luggage is lost	64
please tell me how to spell umbrella	114
please define institutional racism	34
i need to be out of whisper mode	146
i'd like to be out of whisper mode	146
can you suggest some of the most popular travel destination	134
i need to know what day i need to pay my water bill	8
tell me how to spell the word dessert	114
thanks, you've helped me	120
my bank needs to be aware of my trip to spain	133
i want your name to be gerry	21
am i going to need a visa for traveling to canada	61
how many calories are in cake	14
do i have any meetings today between 9 and 10:15	70
what time is in over there in pacific standard time	121
order more paper towels from amazon	80
can you get me simple instructions on how to do an oil change	78
what is your name by chance	143
will a jump start work if my batter is dead	62
get me info on my mpg	72
please revert to the original settings	100
help me book a place to stay from may 2 to may 4 in tampa	10
pass me my gps coordinates	31
cancel my reservation at osteria for our party	16
how much is usd vs cad	39
what kinds of subjects do you know about	142
can you cancel my todo list please	127
what type of outlets do they have in the uk	87
can i find my w-2 online	139
tell me a funny joke about men	118
how long is it going to take me to get to bellevue	37
absolutely not	76
what are the possible reasons behind frozen bank account	1
use my boa account to pay the cable bill	83
help me find some new dinner recipes	67
tell me how to spell doctor	114
please talk faster	23
find the favorite destination for traveling this year	134
do you know the apr on my chase credit card	4
how many paypal transactions did i have last week	129
can you check if my mastercard application has been reviewed yet	3
i need to know the name of my current location for the tow truck	31
engage whisper mode	146
i was in target about to buy a chair when my card got declined	18
when was the last time i took my car in	63
do you think arizona has plenty of bike routes	134
you can remove the brithday party from my calendar fpr january 15, 2019	13
what company is responsible for your design	148
i am trying to find out when is the next payday	84
add wash the dog to my list of things to do	127
put laundry on my list of things to do	127
when will be the next holiday here	74
call me an uber please, and make it for four people to go downtown	135
i need you to schedule an uber pickup for me and three other people at 7pm to go to abe's pizza	135
repeat that for me	96
speed up your rate of speech	23
send from my bbc money market to my t rowe price money market seven thousand dollars	130
i'd like to share my location with stephanie	110
how much pto have i used	91
what is walker bank paying me in interest on my account	59
please add this song to my morning job playlist	136
i want to know when is the next holiday here	74
am i cleared to miss work for vacation	90
please change your response language to english	22
who is your designer	148
what shots are required to visit australia	138
is the apr on my card that ends 1234 what it should be based on my credit score	4
howcan i locate my luggage	64
what do i have going on for 12/03/2019	12
please speak to me quicker from now on	23
how much is 1 dollar worth in country b's money	39
can i have your name	143
is there a routing number for wells fargo	107
is rice bad after 3 days in fridge	44
do i have anything scheduled on my calendar for next tuesday	12
what place were you born	145
what time is my meeting with fred scheduled for	70
has my credit card application been approved yet	3
how long can i keep pork in the freezer for before it gets freezer burnt	44
i call tails and you call heads on this coin flip i need you to do	43
how far along is my credit card application	3
tell me how health chocolate is	77
what's the going rate between usd and cad	39
how should i spell malignant	114
hey ai cancel it now	15
how long should i expect to wait for my replacement credit card	97
tell me what time it is	121
let me know what date it will be in 3 days	33
can you teach me to change my oil	78
make sure i get a meeting room for 9am on friday	109
i want to start calling you adam	21
look up the exchange rate between dollars and euros	39
is my gas tank full or empty	47
order more bread please	80
should i get shots if i'm going to go to thailand	138
what is the correct amount of ounces in a pound	69
do you know how the ratings are for yardhouse	102
how long since my oil had a refresh	63
please pair my phone	116
switch language for me	22
increase the speaker volume please	25
tell me how to make a vacation request	89
are there any travel alerts for brazil	132
i'd like to know your name	143
do i have plans on 12/03/2019	12
do i need to get any shots before volunteering in the congo	138
can you tell me my credit rating	30
are you an actual human	5
which subjects can you tell me about	142
explain how do i get new insurance	58
book room for me and her under the name kendra	101
don't talk so slow	23
do you own any animals	38
please talk slower for me if you can	23
if i travel there, do i need a visa	61
i need to be reminded	95
where do you hale from	145
is traveling to france safe	132
how long will it take to get to tacoma	37
speak german	22
what can i do in hong kong	134
will i be permitted to take my vacation	90
tell my something funny	118
send my current location to steve, please	110
is my order at the delivery address	82
do i have any meetings on my calendar today	70
thank you for the chat, goodbye	49
what transactions did i put on my visa last month	129
i can't give you an answer to that	66
put this in my workout playlist	136
my card isn't working because its destroyed	32
can you move my money to my savings	130
give me a good recipe for chicken parmesan	92
remind me to call my mom	95
tell me how to say hello in chile	131
complete a roll on a 4 sided dice	105
i would like to find a list of cool things recommended for tourists in copenhagen, denmark	134
give me location for tourist destination in bangkok	134
give me harry potter trivia	46
i need know know the reward balance for my visa	104
you can remove the play date from my calendar for feb 18, 2019	13
can you answer all types of questions	142
what are my health benefits like	57
do i need to get any shots before travelling to australia	138
when should i change my oil	79
is there an uber going to downtown	135
where can i locate my routing number for chase please	107
convert 100 dollars to euros	39
i need your help finding my lost phone	41
i want you to skip this song	75
you can call me jason	24
can you tell me the due date for the water bill	8
will you please read the things on my shopping list	111
does my tv need a socket conveter in ny city	87
i would like to learn to make cookies	92
needing you to play the next song	75
can you tell me how good my card's apr is	4
what's the exchange rate betwen usd and euros	39
i am glad that you did that	120
i'll use what ingredients for lasagna	56
add my next doctor visit to my calendar	13
send joe a text	119
please let me review all items on my mastercard from this billing period	129
i'd like to know how to make changes for my insurance policy	58
how much do i owe on all of my bills	7
put whisper mode on	146
can i keep rice in the fridge for 3 days	44
what is it at, the ac temperature	113
repeat my to do list	126
i do not know the answer to that	66
recipe for beef stroganoff	92
why was my credit card not accepted	18
how do i get to the movie theater by bus	36
provide assistance on what to do to make a vacation request	89
what pets are with you	38
is raw carrot healthy to eat	77
i really need to get a volkswagen car rental for march 5th to march 8th in phoenix	17
transfer ten dollars from my wells fargo account to my bank of america account	130
please make the timer for cooking for for 2 hours	122
what should i do if i lost my luggage	64
i want to know where to visit in bangkok	134
give me the date	33
put wash the dog on my to do list please	127
no good	76
i need to know the credit limit	28
can you tell me what a septuagenarian is	34
can you initiate a block on my bank of america checking asap	45
can you find me a round trip flight from denver international to new york international on the 3rd through the 7th	9
which kinds of info are you familiar with	142
who conjured you	148
would you translate a phrase into mandarin for me	131
goodnight	49
do you think my name is jeff	137
where do i report if i lost my luggage	64
what date will it be 8 days from now	33
i am now out of checks, how do i order new ones	81
don't talk anymore	15
can i get my car jumped for this dead battery	62
what is the amount i owe to clay electric	7
what kind of ingredients go into the chicken a la king	56
what is my old navy card's rewards balance	104
what hour is it in london	121
i need a w2 form, how do i get one	139
what is the interest rate at pnc	59
give me celcius to fahrenheit	69
i want to change the pin number on my credit union account	85
do you have any animals	38
i would like to have my credit increased to 5000 dollars	29
how safe is visiting canada this week	132
will i be charged if i use my card in vietnam	60
at what point will the review of my credit card application be completed	3
what song am i hearing	144
hi, ai	50
tell me the exchange rate between here and country b	39
i enjoyed our talk, goodbye	49
what's the status of my medical leave	90
what are your hobbies siri	141
does my visa have international transaction fees	60
does spago in beverly hills allow customers to make reservations	0
i feel like going out for sushi tonight who in the area serves good sushi	103
is it okay to switch apples for grapes	55
how much did i spend on shcool due last year	115
when should i change my tires	124
now restore the original settings	100
can you show me how to report a lost card	99
i need to know if boston restaurant has favorable reviews	102
switch the pin on my visa account	85
which holiday do we celebrate next	74
my card was in my pocket and bent	32
what is the balance in my pnc account	6
how long is the wait at applebee's tonight	51
how do you show my name	137
help! i'm a victim of credit card fraud!	98
what do i have to do	126
is cooked chicken still good after being refrigerated for two weeks	44
how long to washington dc on a bus	37
what are the cuban plugs like	87
was my order shipped here	82
i enjoyed speaking with you	49
can i make reservations at spago in beverly hills	0
how many pto days are in my possesion	88
was is my salary	54
what benefits do i have for insurance	57
please roll a dice	105
do i have any meetings today between 9 and 10:30	70
i would like to know delta's carry on policy	19
tell me what my name is	137
what is the least i can pay towards my car bill	71
are there any travel alerts for juarez	132
no, that's not it	76
help me book a car rental in chicago for april 1st to 3rd get me an suv if possible	17
explain what my credit limit is	28
does more than one carry on cost extra at ryanair	19
what animals await you at home	38
what's the gas mileage on a juke	72
could you tell me what kind of money i've recently spent	115
what type of pet is in your home	38
what's my credit limit for my visa card	28
will you start calling me chaz	24
where can i locate the ally routing number	107
i'm wanting you to flip a coin	43
add to my list of things to do: wash the dog	127
could you tell me how to make changes to my insurance policy	58
i lost a card and i need to report it	99
possibly either one	66
what are my coordinates	31
my card is lost and i need to know how to report it	99
put one hundred and seventy five bucks in my wells fargo checking account from my citibank savings account	130
where can i locate the pnc account's interest rate	59
where is your favorite restaurant to eat	103
what can i do if i lost my luggage	64
how many pto days are available	88
i need to know what dominate means	34
can you remove this event from my calendar, please	13
was my order brought here	82
how many calories are in a serving of deans french onion dip	14
what is the procedure if i lost my luggage	64
show me a plan to help my credit score rating	53
can i change you name to gretchen	21
make an alarm for one and two in the morning	2
i need quiet; use whisper	146
my card was stolen, how do i report this	99
is rice good for me	77
take one hundred and fifty bucks from my wells fargo checking account and put it in my wells fargo savings account	130
can i make an appointment to get my tires checked	108
what do i owe on telephone and cable bill	7
can you tell me if there is anything on my todo list	126
how much have i recently spent	115
how would i go about spelling malignant	114
how is the steamed fish at harbor village	102
are there any necessary shots required before travel to thailand	138
define antagonist for me please	34
when will my credit card application be reviewed	3
what is the total of my repair bill	7
will you check to see if i am still reserved for 6:30 pm at gusto handcrafted pasta & pizza	26
what will be the weather tomorrow	140
set me an alarm now	2
you have my gratitude	120
set a reminder for me to request time off work around the holidays	95
i need an idea for a french dinner	67
what is the apr on my citibank card	4
what day of the week are we on	33
how many tablespoons are there in half of a cup	69
what are the steps required for making a vacation request	89
i need a roll on a 6 sided dice	105
flip a coin now	43
disconnect sync from my phone	116
please skip this song for me	75
i need alarm for both 4am and 7am	2
i want to pay a bill	83
put song in springtime playlist	136
did my vacation get approved yet	90
can you tell me where my phone is	41
i wanted to remember somethings, what was it	94
when did the oil get changed	63
tell me my reminder list	94
british columbia can be found in what timezone	123
how many day off i have taken	91
what is the amount of time i can request off in the coming year	88
what timezone do ho chi minh use	123
help me set a timer please	122
your accent needs to be changed	20
can you tell me the ingredients used in pasta sauce	56
can i rent a car from dfw airport from march 1st to march 8th	17
you can remove the dinner party from my calendar for january 21, 2019	13
who is your manufacturer	148
what place were you made at	145
please roll that dice	105
i need to know when is the next holiday here	74
please schedule a meeting with kim at 10 am	109
confirm my johnny rockets reservation for this evening	26
how many miles will i get for one gallon on this car	72
when is the electric bill due	8
i want to report fraudulent activity on my mastercard	98
location currently, where	31
add a doctor's appointment to my calendar for friday	13
what does my running list of stuff to do list	94
find list of ingredients i would need to bake a funnel cake	56
i would like to find out how to cash out cred card points	93
how much money do i make a week	54
i don't want my current pin for my wells account anymore	85
reset to factory settings	100
how much do i pay in taxes every year	117
10 minutes is what the timer should be set at	122
good morning, ai	50
please flip a coin	43
are there any travel alerts for seattle	132
what is the amount of vacation day i have used	91
do my tires have enough air in them	125
what is my tax burden	117
can you make a reservation in tampa from may 2 to may 4	10
will maggianos in charlotte allow me to make a reservation	0
name this song	144
carla doesn't want her olive garden reservation anymore	16
gas type needed for this car	48
my credit limit needs to me changed	29
can i afford a new tv from my savings account	6
i want you to know it's a true statement	149
quit talking	15
who's your creator	148
how much can i spend on my discover card	28
has my request for vacation time been approved	90
this was a nice conversation	49
uber ride available from here to downtown	135
i need to switch accounts	20
at what time is my flight scheduled to land	42
how long before i need to replace my tires	124
is it possible to do a reservation at the bellagio	0
who do i contact for lost luggage	64
can we call mark	65
can you give me instructions on how to make alfredo	92
can you tell me how much air are in my car tires	125
what's the minimum payment on my bill	71
are there any ubers available in my area right now	135
transfer 50 dollars from my checking account to my money market account	130
nice song what is it	144
tell me a fun fact about the moon landing	46
i need your assistance to solve this math problem	11
can you permanently talk faster	23
what is the route to take to report a lost card	99
i want to update my pin number on my bank of america account	85
don't have any idea	66
i would like you to suggest a chinese dish	67
i would like to report a fraud on my wells fargo card, please	98
would it be ok if i have pepper and not salt	55
negatory	76
what kind of miles per gallon do i get while driving through a city	72
cancel my reservation for 5 at the loft	16
how much gas do i have	47
i have no checks and need to order new checks	81
how do i get a w2 form	139
what kind of fuel do i need to put in my car	48
will you please do the male british accent	20
please call me charlile from here on out ok	24
i think dan scheduled a meeting today with me, can you double check please	70
did i put elbow noodles on the shopping list	111
set a reminder for me to request time off	95
undo my reservation for 5 at the loft	16
help me solve this math equation	11
could you translate this into chinese for me, please	131
arrange a meeting room for 9am on friday	109
what you age on your last birthday	52
what's today's weather	140
what withdrawals were there on my account yesterday	129
i am not sure if i have enough money in my chase account to buy a new dress	6
please put a hold on my retirement account right now	45
set up a 52 minute timer	122
certainly not	76
how much is $1 usd worth in euros	39
can you cancel it	15
give my gps location to jason	110
how long before i'm on e	47
how many points have i earned with my amex card	104
could you speed up your speech	23
do i have soda on my shopping list if not please add it	112
where can i apply for a black amex card	73
tell me how i can apply for a chase credit card	73
can you order an iphone7 for me with two-day free delivery	80
could you let me know how many pto days do i have left	88
i need to know when my credit card is going to expire	40
my card was rejected at the zoo, could you tell me why	18
is there a holiday this month	74
is it possible to add grapes to my shopping list if they aren't on there already	112
should i cook this for a long time	27
are you a robot	5
can my 401k rollover or not	106
how many tablespoons is 5 teaspoons	69
configure this to factory settings	100
go into whisper mode	146
someone is charging my card for playstations, and it's not me! what do i do!	98
what is our purpose	68
what is seventeen plus three	11
would it be a problem to sub chips instead of fries	55
how many vacation days have i accumulated	88
what is the process of reporting a lost card	99
please use your whispering voice; i need quiet	146
spirit mastercard card was taken	99
how do i get rewards from my visa card	93
was my last transaction at walmart	129
can you tell how many days i already took off this year	91
my account looks to be blocked and i have no idea why	1
i ordered some new speakers, so when will they get here	82
please turn your speaker volume up	25
what is that song called	144
i'd like to increase my credit limit	29
order all of my shopping list	80
how long do i put sugar cookies in for	27
what hobbies do you have alexa	141
what is the process to set up a meeting	109
tell me where i left my phone	41
what kind of interest can i expect with my chase account	59
i need a hotel room for 7 people in st louis for november 3rd through 5th	10
tell me a cool fact about reno	46
rescind	15
my car needs maintenance but i don't know if i can schedule an appointment for that	108
do i have cheese on my shopping list if not please add it	112
can you help me add the song i listen to to my clutch playlist	136
how bad is traffic on the way into oakville right now	128
please call mark	65
please turn the tv on	113
how many ounces in a liter	69
where did you come from	145
relate to me what my credit score is	30
read my reminder list back to me	94
i need to let my bank know i will be in america from april to may	133
when will my vacation get okayed	90
what's the exchange rate between country a and country b	39
i keep trying to figure out if i have enough money in my chase account to purchase a new set of tires	6
how long does it take before you have to change your oil	79
tell me how the traffic is on rt 7 to the airport today	128
are you a human being or a computer	5
what is the current status of my credit card application	3
i would like to reserve a table for 2 at sam's steakhouse under the name jessie at 6:30 pm	101
will my 401k carryover	106
i want your name to be henry	21
let carl know that he sucks	119
what do i need to jump start a battery	62
can you find me a flight from denver international to new york international on the 4th for under 700 dollars	9
malignant is spelled how exactly	114
please call felicity	65
i need to know what my limit is on my american express card	28
how much have i spent on eating out recently	115
i was wondering about the vacation time you said you'll approve	90
the ac, could you tell me the temperature	113
at what time should i be boarding my flight	42
i ran out of checks and need more asap	81
what insurance do i have	57
what to do in minneapolis	134
can you remove that event from my calendar, please	13
how many years have you been living	52
thank you for the help	120
how much money a year do i spend in taxes	117
please change your language setting to russian	22
please skip this song and go to the next one instead	75
will it take more than a month to get a new card	97
i need a new pin on my chase account	85
what can i do to get a better credit score	53
i need to report unauthorized activity on my card	98
can i have a reminder set up	95
can you please tell me how long it will take to get to target in austin	37
what's my income before taxes	54
i accidentally caught my card on fire	32
let me know the amount of vacation days i have used	91
when is the next holiday in this country	74
