can i have a reminder set up	95
what's my income before taxes	54
let me know the amount of vacation days i have used	91
i'm out of paper towels so will you put that on my shopping list	112
i did not hear what you said	96
how old are you in 2019	52
siri, call jacob	65
please let me know if my discover card application has been approved	3
i need my credit limit changed	29
i want you to reset to factory settings	100
can you tell me how many vacation days have i taken	91
please pair with my phone	116
i need an alarm set for ten pm and midnight	2
do i have enough gas to get to buffalo	47
is 126 divisible by 8	11
i want assistance with my utility bill	83
add up 8 and 7	11
transfer funds to the other account	130
tell me about the chase credit card application process	73
thanks for your help	120
send me an uber to arrive at 5pm at my house and there will be two people going to scully's downtown	135
can you tell me a joke about a lawyer	118
does long horns do reservations	0
does greece currently have any travel alerts in place	132
how can i set up a meeting	109
how much time to drive to the closest bank	37
how long does it take a new card to arrive in the mail to me	97
change your accent now	20
erase my to do list	127
talk faster than that	23
can anyone let me know the reason behind my frozen bank account	1
next song please	75
i need my reservation to be cancelled for nugget to xiomara's restaurant	16
do you know what my precise credit score is	30
raise my credit limit	29
i'm out of cleaning supplies, remind me on my list	112
heyo	50
i would prefer not	76
what timezone is the country in	123
what is 87 divided by 4	11
what is the next song on this playlist	75
let me know my card's apr	4
can we stop my bank account	45
i'm sorry please repeat the question	96
go back to default settings	100
i am bored and need new dinner recommendations	67
what timezone is hanoi in	123
can you speak more slowly	23
on tuesday i will be leaving for tennessee and will not be returning until the twenty ninth, alert my bank of this	133
i need a reminder to order cookies	95
how do i get to the fine arts center by foot	36
am i able to rollover my 401k	106
where are you from if i may ask	145
using my card in tulsa won't cause me to be charged extra will it	60
will flight dl123 be on time	42
make the male british accent please	20
i want to call you maggie	21
can you set a reminder for me	95
what time is my flight going to land	42
my card just got declined when i was in home depot buying tile	18
can you play music by the beatles	86
how well is the gas mileage while i'm in the city	72
how much spending power is on my discover card	28
i have to know the credit limit	28
please delete my todo list	127
what timezone is london in	123
which timezone contains the city of orlando	123
add games without frontiers to my week 5 playlist	136
will my card expire on a certain month	40
are you 16 years old	52
put in an order for more checks	81
w-2 tax form where is it	139
i'd like an appointment at your earliest availability for an oil change	108
fetch the song smells like teen spirit and play it	86
please ask me again	96
how many calories are in a bowel of wheaties	14
please say that again	96
can you roll a dice for me	105
i'm at a new job and i need to do a 401k rollover, how do i do this	106
did i remember to put eggs on my shopping list	111
i'd like to change the pin number on my visa account	85
when is my flight boarding	42
i'd like you to add oranges to my shopping list	112
rollover my 401k assistance	106
what is the best type of gas for this car	48
i meant no	76
do i need a travel visa for the uk	61
when was my last oil change	63
dial the last number that called me	65
what's my federal tax this year	117
what are the steps to take to report a lost card	99
reserve a table for 3 at andrea's steakhouse around 5pm under the name wheeler	101
i want to find a flight for under 700 on the 4th from denver international to new york international	9
what's your home town	145
i'd like to send steve my location	110
where can i find a page showing my how to change my oil	78
how to change oil of a car	78
what is my insurance coverage	57
i have an appointment on the 5th put it on for 5pm	13
alert my bank and tell them that i will be in vermont	133
are you able to switch butter and oil	55
what are the ratings for yardhouse	102
need help with frozen bank account	1
can i increase my credit limit	29
stop syncing with my phone	116
how much interest do i get on my citizen's savings account	59
what kind of gas is required for this car	48
what is the time zone of china	123
can you give me the carry-on rules for american airlines	19
are butter and oil interchangable	55
i need a timer that is set at 1 hour exactly	122
is there enough in my savings account to get a new tv	6
is my dinner reservation for gusto handcrafted pasta & pizza at 6:30 pm still valid	26
can you help me change my credit limit	29
where is the closet bus stop to go to downtown dallas	36
i want a block placed on my college fund account immediately	45
how are those mcdonald's reviews looking	102
what is 543 times 344	11
erase the items on my to do list	127
let me know if grub burger takes reservations	0
find me cat trivia now please	46
figure out for me when i ought to change my tires next	124
where were you programmed	148
401k rollover help	106
i want the name of your boss	147
assist me in getting a new credit card	73
do you remember when i last got my car looked at	63
is chocolate good for you	77
i want new language	22
how many ounces in a cup	69
what's my pnc balance	6
you need to change your language setting to russian please	22
cancel reservation at eight for the group	16
how do you spell umbrella	114
can you create a meeting for 3:00 on wednesday	109
please double check on my reservations for buffalo wild wings at five for the game	26
give me the timezone where vancouver is	123
has my maternity leave been approved	90
what is the proper fuel type for my car	48
let me know if i can use ketchup in place of the mustard	55
can you check on the status of my credit card application	3
how many hours of vacation have i saved up	88
are you involved in hobbies	141
can you tell me how many pto days do i have left	88
how do you say hello in mexico	131
i want to change my bank of america account pin number	85
how much fuel do i need to get to buffalo	47
what name is saved for me	137
what kind of oil and how much do i need for my toyota tacoma truck and how do i do it	78
where do i go to look at my credit score	30
is a shot required before traveling to mexico	138
i want to know how to change oil, tell me the steps one at a time while i work through it	78
help me book a car rental in austin for april 11th to 13th get me a sedan if possible	17
i need to know why you declined my card yesterday	18
why are humans on earth	68
can the 401k i have be rolled over	106
what's the date of my next paycheck	84
i would like to try and confirm that i have a reservation at outback for josh	26
tell me an axolotl fact	46
i must procure a car rental for the 10th to the 15th in zimbabwe and i would prefer a bmw	17
who programmed you	148
suggestions for thai food	67
how soon until my tires will need to be changed	124
tell me the duration it takes to get a new cc	97
when is the expected arrival of flight dl123	42
was my order delivered	82
please place this track on my driving mix	136
the name is nick	24
does boston restaurant have favorable reviews	102
what's your birthday	52
what is 13 times 57	11
what would you say is a good german dinner idea	67
please lookup my experion credit score	30
i need to text joe	119
are the review for mcdonald's good or bad	102
please notify my bank that i need more checks	81
you need to remind me to do something	95
could you tell me how many pto days do i have left	88
is there any traffic on the road i take home from work right now, rt 40	128
can you tell me what kind of life form you are	5
what is the present status of my credit card application	3
how can i make sure that my credit score does not decrease	53
what time is it in the pacific timezone	121
do you work for a different individual	147
report a card lost for me	99
can i take more than one carry on	19
take me out of whisper mode	146
show my gps location to brittany	110
how many miles away am i from madison square garden	37
please repeat what you said	96
what day is the next holiday	74
how does the traffic look on my way to work right now	128
please add bananas to my shopping list unless i already did	112
what are you interested in	141
how is the car tire pressure doing	125
how much gas do i have left	47
when did i change my oil	63
what is the minimum amount due on my cable bill	71
turn up your volume	25
show me all video games purchased	129
if i go to uganda, do i need an international visa	61
i would like to know if my visa card application has been approved	3
whats on my reminder list, read back	94
what is the eta on getting a replacement card	97
has my credit card application processed yet	3
how many points do i have with my american express	104
what rules does southwest have for carry-on luggage	19
either of them could be i'm not sure	66
what is the gas level in my gas tank	47
accepted	149
is my order here	82
it seems that my account is blocked and i'm not sure why	1
where am i at currently	31
for under 700 i need a flight from denver international to new york international on the 3rd	9
what's my income tax	117
can i get a car rental in boise from april 11th to april 13th	17
which time zones does european countries use	123
can you find me an uber and have it here at 7pm	135
i would like to know if you are an artificial intelligence being	5
talk to me about where im at right now	31
is the bill due this week	8
where do i find my routing number for my pnc account	107
idk	66
how do i prevent my credit score from dropping	53
order an amazon gift card from amazon in the amount of twenty dollars	80
how much is my kill bill bill for	7
how many calories are in ice cream	14
how far along is my purchase	82
would you skip this song	75
add welcome to the jungle to my workout mix	136
thank you for your help	120
disconnect from phone	116
can you tell me when i should change my oil	79
i want the pin on my wells fargo account to be changed	85
could you talk a little faster	23
create a timer that is set to go off after 25 mins	122
what transactions have i accrued buying dog food	129
i want to be out of whisper mode	146
tell me the meaning of condemnation	34
i think my luggage is stolen	64
what date will it be 5 days from now	33
what's delta's carry on policy	19
what is the meaning of word alliance	34
i need to know how long to cook chicken for	27
define monetary for me please	34
what is the time in paris now	121
what am i listening to right now	144
i'd like to know if my account's blocked and the reason if so	1
i am enrolled in what insurance plan	57
what new credit card should i submit an application for	73
tell me the forecast	140
order a case of coke from amazon	80
i want a clean bootup to factory settings	100
tell me something to make me laugh	118
i need gas so what should i get	48
i'm exploring a possible cycle flight from yyz to dublin for w to aug two	9
how can i jump start my car if my battery is dead	62
how do i rollover my 401k	106
what is on my shopping list	111
set me an alarm right now	2
are there any current travel alerts for brazil	132
how long will it take for me to get to the gas station	37
what do you think we are on earth for	68
who makes you	148
can you divide 100 by 20	11
i need to know what my gps coordinates are	31
for flight dl123 what's the status	42
is it possible for you to read the things on my shopping list	111
how might i go about jump starting a car	62
who brought you into existence	148
let my bank know that i am going to tokyo	133
i want to buy an iphone7	80
how much am i being taxed	117
how do i increse my credit limit	29
clear something up, are you a robot	5
what time is it in pacific standard time	121
what's today's high and low	140
how do you know if your oil needs changed	79
so what are my current gps coordinates	31
tell me my income amount	54
confirmed	149
i need to reserve a large room or suite for 2 couples for august 15th through august 18th in seattle	10
i ordered new light bulbs online when will they get here	82
if going to lake placid, ny, how long would it be by bus	37
how good is my card's apr	4
tell me carry-on info for united	19
can you play the song that starts with doo doo doo	86
is my card's apr good	4
please tell me how much money i have in my bank accounts	6
when you have free time, what do you do	141
do i have toothpaste on my shopping list	111
set a reminder to check the steak	95
is it a short time before i receive my new credit card	97
i get an error message when i try logging in to capital one that says i'm locked out	1
i want you to set alarms for 2pm and 3pm	2
where is the closest red lobster to my location right now, which is 5th avenue	36
enable whisper mode	146
could you please change your accent to the male british one	20
do i have meetings with anyone today	70
what are your interests	141
please flip coin ai	43
what is your given name	143
roll a 6 sided die and tell me the result	105
what would be the least i could pay on this bill	71
i need to know the pin number	85
i need more checks because i am out	81
how can i cash in my visa rewards	93
is my milk safe to drink after being in the refrigerator for a week	44
does mcdonald's have good reviews	102
will pepper work instead of salt	55
when is the next payday	84
how long since my car was in the shop	63
how do i get to the court house on foot	36
please set a timer to go off in 45 minutes	122
rolling over my 401k help	106
when did i last get my car checked	63
i need to apply for a new credit card that will match my needs	73
can you spell the word umbrella for me	114
i was flying out of chicago on american airlines flight ab123 and my luggage is now lost	64
you are correct	149
my card is lost, i would like to report it	99
what is the expiration date of my milk	44
how can i change information on my insurance policy	58
which day is pay day	84
i'm out of clorox wipes so will you put that on my shopping list	112
pay my water bill from my chase account please	83
what is my credit limit on my discover card	28
forget reservation at oyster bar for tonight	16
please tell me when is the next holiday here	74
could you translate water into dutch for me	131
mayonaise has been in my fridge for three years, is it still good to eat	44
can you repeat that question	96
let me know how many vacation have i utilized	91
tell me whether i can put a pto request in for may 10 to may 15	89
can you give me a traffic update for a trip to the grocery store	128
i couldn't say	66
can i travel to south africa without getting a shot	138
can you share my location with roger	110
i need a hotel with good reviews in baltimore	10
how much pto have i used so far	91
can you skip this song and go to the next one	75
i need to make a vacation request; how	89
for this car, what kind of gas should i use	48
that is not factual	76
i'm flying delta and need to know the carry-on rules	19
what amount of gas do i have left	47
how long before my updated cc takes to arrive	97
i want to be called tom	24
how late is it now in ourense	121
please tell me where to get the w2	139
while in tulsa, if i use my card, would i be charged more	60
share my gps with tom	110
will i have enough to get a new roku with my savings account	6
ostensibly when is my flight going to land	42
specify who your boss is	147
true, most definitely	149
whats the minimum payment on my electric bill	71
tell me the title of the song playing	144
what's the tax bracket for my income	117
call an uber and have it pick me up at my present location	135
what is the process for making a vacation request	89
if i want to direct deposit my paycheck, what info do i need	35
give me a cool fact about puppies	46
can you tell me how much i spent on grocery shopping recently	115
what does my commute look like	128
for the love of all that good change your accent	20
show me a hotel that has good reviews in kansas city	10
what is covered under my insurance	57
will i be able to schedule a reservation at 4 seasons in los angeles	0
agreed	149
what's the minimum due for my electric bill	71
who is your supervisor, please	147
what's my bill's minimum payment	71
what was the date of my last paycheck	84
recite my to do list	126
do i have any meetings today between 9:30 and 10:30	70
do you have a nickname	143
show tracking information on my replacement credit card	97
you must change your language setting to russian	22
my insurance plan is what	57
how long would the wait at the restaurant be	51
i need a pancake recipe	92
send me an uber now for four people and we are going to appleby's downtown	135
did i forget to put protein shakes on my shopping list	111
how many days have i taken off	91
flip coin ai	43
can you tell me how long approximate wait times are at cheesecake factory	51
make me a reservation in tampa from may 2 to may 4	10
my day offs history	91
how do i get to the bus stop on foot	36
i'm striving to find a 2-way flight from jfk to dtw for w to july 3	9
can you give me a chinese meal suggestion	67
how many calories are found in bagels	14
what is the status of my vacation time request	90
when should i change the tires	124
what is the sum of 3, 7, 9, and 24	11
how can i jump start my car	62
how old were you on your most recent birthday	52
can you please change you accent to the male british one	20
i broke my card when i bent my wallet	32
tell me your funniest joke	118
where were you born as a kid	145
use the name wheeler to reserve a table for 3 at andrea's steakhouse at 5pm	101
what are the ingredients used in chicken curry	56
how long to wait before dining in restaurant beta	51
what type of animal is living in your home	38
start a call to cynthia	65
call aj please	65
how are british plugs	87
i think my luggage is missing	64
i want your volume lowered	25
will my debit card go bad any time soon	40
will i need an international visa to go to madagascar	61
what do you have in the way of pets	38
where is the closest park	36
does canada require a visa	61
has the apr on my card changed and what is it now	4
what's the name you were given	143
how do i report fraud on my chase bank card	98
i have a card that was lost i need to report	99
are french fries health or not	77
tell me where i should get the w2	139
what's my credit limit	28
i'd like to know when my next day off is	74
what is the best way to keep my credit score from going down	53
find me a flight from philly to atl for june 5th to 8th	9
do i need to have any shots to visit chile	138
i want you to call me a different name so can you call me charchar	24
do my car tires have enough psi in them	125
what steps do i need to follow to change the oil in my car	78
what is the purpose of existence	68
what kind of plug is used in japan	87
how to cash in visa card rewards	93
do you need shots before going to russia	138
i need laundry to be put on my list of things to do	127
transfer 1000 dollars from my first national bank to my bethpage federal credit union savings	130
forget reservation at longhorn for 4	16
share my location with steve	110
will i be charged if i use my card in russia	60
i want to report fraudulent activity on my visa	98
did i put a car wash on my todo list	126
will i be charged if i use my card in japan	60
find a recipe for hamburgers	92
assistance in rolling over my 401k	106
where do i have to be on 12/03/2019	12
track down my phone for me	41
find out why i can't log in to my bank of america account	1
look up carry-on rules for american airlines	19
stop synching to my phone	116
what other accents can you use	20
do you know any good jokes you would like to share	118
what kind of traffic can i expect on the way to church	128
when will my car need new oil	79
i need to book a reservation for 3 at xenophobe under the name zebee	101
give me a cool fact about new orleans	46
i wonder if it would be possible to switch from apples to grapes	55
i'm seeking a full circle flight from msy to msp for w to june 7	9
hi	50
my utility bill is coming due and i need a loan	83
would i be able to swap apples for grapes	55
please reserve a table for 2 at lucky's under the name melissa at 7 pm	101
call my friend aj	65
at the point when should i get my oil changed straightaway	79
when was i paid most recently	84
you've been a big help	120
please abort the current process	15
pocki sticks has how many calories	14
i will now call you adam instead of your old name	21
can you help me find someone to look at my car's engine because the light is on	108
whats the number of pto days i have to my availability	88
i want you to use a different accent	20
what day is my telephone bill due	8
how is my name saved	137
i'd like you to pair with my phone	116
i've forgotten my pin number for my citibank gold account	85
now, i want you to play the next song	75
it was lovely to speak with you, bye bye	49
when is my cell phone bill due	8
could you please reserve a table for 6 at lucille's under the name tom at 5pm	101
can you act and think like a real person	5
what was my income last year	54
i'm going to paris, what plug type do i need	87
is there a reservation available at ruth chris today	101
when is my order coming	82
how much vacation do i have saved	88
i want to change your name to adam	21
i want to call up jan	65
i want to know what the purpose of life is	68
i want to know when is the next holiday	74
tell me the meaning of life	68
set my alarm for six tomorrow morning	2
i appreciate you doing that	120
are more than one carry on allowed at klm	19
a pleasure as always to speak with you, bye	49
what appointments do i have on thursday the 14th	12
are you secretly real	5
when is the next break	74
hi what's up	50
instruct me what to do	126
how many of my off days have i run through for the year thus far	91
how long should i cook steak for	27
my card is ruined and isn't working	32
i'd like to book the next availability for an oil change	108
what is the average wait time to be seated for dinner at rouge	51
can you find me my phone	41
what's that song on the speaker now	144
i need to know favorable reviews about boston restaurant	102
do you know the calorie content of a strip of bacon	14
please put a block on my us bank account immediately	45
do you know where my cellphone is	41
what is your age again	52
what's your opinion on the meaning of life	68
adjust the volume to level 4	25
what would the routing number for chase be	107
how high is my spending limit on my wells fargo card	28
what's the traffic like going to central park	128
read all my reminders	94
i need a list of ingredients required to make lamb stew	56
if i plan on travelling to this country, do i need a visa	61
connect me with an uber	135
make my settings go back to their factory settings	100
has my purchase been delivered yet	82
what things can i do to increase my credit score	53
what will the traffic be like if i headed out to work right now	128
what hobbies do you have	141
do they use a different plug in brazil	87
how do you make dumplings	92
for the shopping list, order everything	80
where am i on gps	31
hey	50
was there a problem with my card yesterday	18
can you repeat what you said	96
were you made here	145
does one need a visa to go there	61
what would you say is the best meal to have for dinner	67
do you know the deeper meaning of life	68
did i put vacuuming on my todo's	126
will jet blue allow more than one carry on	19
can you pair with my phone	116
how much money have i spent on restaurants	129
how many calories does two bananas have	14
what creatures do you keep for love	38
what sort of jokes do you know	118
i would like to get today's date	33
i will tell my bank that i will be gone from april to may to america	133
tell me please what paean means	34
i want a block placed on my checking account right away	45
i was trying to buy a chainsaw at the tractor store and they said my card was declined	18
amazon visa card is stolen	99
can you raise your speaking speed	23
how do i go about setting up paycheck direct deposit	35
let me hear something funny	118
what are the different subjects that you know	142
tell me what today's date is	33
tell me how are you	50
what are the things i wanted to recall	94
what's the chance of rain	140
list the things i wanted to remember	94
i need you to stop talking	15
please tell me this month's transactions on my visa	129
can you translate this name into spanish for me, please	131
i am needing the next song to be played	75
how do you spell dessert	114
how long can i keep chicken in the freezer for before it goes gross	44
what gas does this car take	48
speak french	22
how many calories are in apples	14
can you define the word schadenfreude	34
what is 89 divided by 3	11
i need a car rental this week	17
could you tell me the temperature of the ac	113
what electrical plug do they use in the uk	87
factory settings restoration	100
will i have to wait long for a table at pietro's this evening	51
i do not think that is proper	76
i would like to know flight dl123's status	42
would you please schedule a reservation for 2 at lucky's under the name sam at 7:30pm	101
what is the time in london	121
is rice ok after 3 days in the refrigerator	44
i have no oranges, put them onto my list	112
is there lettuce on my shopping list	111
give me your best joke	118
yes, that is true for sure	149
thanks for helping me out today	120
how long do i need to cook pot au feu for	27
what things did i not want to forget	94
what's the status of my vacation days	90
what date is the next day i get paid	84
what day do i need to pay my internet and phone bill by	8
what time of day is it	121
help locate my phone	41
are you from here	145
tell me what the interest rate is on my personal loan through chase	59
mark my calendar that i will be meeting steven on march 5	13
please turn the volume to 4	25
