what do i get taxed at my income level	117
inform me of the calorie content of vanilla ice cream	14
direct deposit my paycheck to my capital one account	35
tell me when my mastercard bill should be paid	8
i need to cancel my reservation for 2 at franklin's grille	16
can i modify the apples for grapes	55
the statement is true	149
are there any vegan restaurants in my town	103
i want to report fraud on my american express	98
what's the mpg of my car	72
do you posses any types of pets	38
do you have hobbies	141
will you respond to adam instead of the current name	21
can you help me rent a car in las vegas	17
what is the remaining time until we are at our destination	37
give me kilograms to pounds	69
who you work for	147
can you help me increase my credit limit	29
how healthy is pumpkin pie	77
what did i do with my phone	41
should i a gas refill for my car at the next gas station	47
make me an appointment for a tire check	108
is joey my name	137
if i go to brazil, do i need to get an international visa	61
what company designed you	148
switch back to factory settings	100
how much have i spent on shoes recently	115
do you have an age	52
i need to know what routing number i should use for ally	107
you know the reservation i have on 2:00 friday i confirm it	26
what does my credit card charge for their annual percentage rate	4
cash in my credit card rewards	93
how do you say good bye in french	131
pair with phone	116
where are you from oroginally	145
how long does it take to cook hot pockets	27
what was that question again	96
what are you capable of answering	142
my card was rejected at shakey's and i am wondering why	18
help with credit card points	93
remove my todo list	127
when do i need to change my motor oil	79
perhaps	66
how does my card's apr compare to others	4
create a reminder	95
can you tell me how changes on my insurance policy can be made	58
change to a new accent please	20
how much country of canada money would i get for $100	39
what kind of fuel does my car use	48
could you book me an appointment for an oil change	108
schedule an uber to pick me up at home in an hour	135
is my day open for march 4th 2019	12
i was just at target and they declined my card and i can't understand why	18
so where do i get the w2 form	139
what's my total earnings	54
name a few good steakhouses in chicago	103
i want to hear something hilarious	118
what is the air pressure of my car tires	125
is there a way to increase the limit of my credit to 5000 dollars	29
i need an airline ticket for a round trip flight from philadelphia to atlanta for the dates of june 5 - 8	9
where do i rent a car in las vegas from november 16th to december 16th	17
tires should be changed when	124
i need to arrange an appointment to have my car's tires examined	108
how do i say thank you in spanish	131
pull up ramen recipes please	92
there's something fishy on my card, report it	98
how long does it take milk to expire	44
latitude and longitude please	31
i have lost my phone	41
i need you to create a timer	122
i'm telling you this is a true statement	149
what do my bills look like for amazon and netflix	7
will getting a credit card help my credit score	53
when was the car last services	63
which type of pet would you rather possess, a cat or a dog	38
what happened to my cellphone	41
i just put steaks on the grill remind me to check them at the right time	95
i need a spider fact	46
i want to apply for a new credit card	73
what does distinguish mean	34
i broke my card trying to do a magic trick	32
so when should i change the oil	79
hell nah	76
do you work for a different person	147
will i get charged extra for using my card while in tulsa	60
would you say you are a bot	5
who formed thou	148
can you give me some fun suggestions for tourists to check out in las vegas, please	134
will my 401k rollover	106
i need to report a stolen card	99
stop calling me charlie and from now on always call me chip	24
add what i listen to to my car ride playlist	136
i forgot my pin number for my credit union bank account, can you help	85
what timezone is paris in	123
do i have more than $100 in my pnc account	6
where is the closest subway entrance to me to go to brooklyn	36
are you able to call me by my name	137
wipe my todo list please	127
whats the policy for delta for carry ons	19
when will the clothes i ordered online arrive	82
my luggage is lost	64
how long would it take to get to mcdonald's in houston	37
how much money do i make at my job	54
is there much traffic between here and work right now	128
i need leslie to be texted saying have a good day	119
i need kilograms to milligrams	69
tell me my phone's location	41
how long until my oil needs to be changed	79
who has the best credit card offering for a college student	73
i was at walmart trying to buy toilet paper and my card got declined	18
is there any danger going to brazil	132
when does my oil need to be changed	79
how much vacation have i earned	88
what interest rate am i getting currently from oak bank	59
what types of furry companions do you have	38
what's the name of the song playing right now	144
i need to know how much 100 dollars is worth in euros	39
confirm the doors are locked	113
i want you to turn the tv on	113
i enrolled in an insurance plan, what one was it	57
share with current location with ben	110
could i get assistance booking a car rental in las vegas	17
how's the traffic looking if i headed to fred meyer	128
i want you to add the song i listen to to my summer playlist	136
engage all the door locks	113
is there a routing number for wachovia	107
am i able to make reservations at spago in beverly hills	0
make your name steve	21
what's my income from work	54
when do i need a new credit card	40
did my order get delivered	82
i will require help to take care of my utility bill	83
what is the insurance plan i am enrolled in	57
when do i need to change my motor oil again	79
what do you call yourself	143
what is your current age	52
what might i need to do to direct deposit my paycheck	35
would you play the next song	75
tell me a fact about the maned wolf	46
it was lovely to speak with you	49
i need you to act swiftly and freeze all activity on my capital one checking	45
please start the song penny lane	86
what's the danger level of flying to russia right now	132
is it possible to rollover my 401k	106
how can i get a new card that got melted in the sun	32
how do i do a jump start on my car	62
what did you ask again	96
i ruined my card when it got washed	32
when my house burned down, so did my card	32
do i have tortillas on my shopping list if not please add it	112
can i ask your name	143
how is the car's tire pressure	125
how much do i have to pay on taxes and cable	7
can i make a change to my credit limit	29
what is my tire pressure	125
can you tell me when i ought to switch out my tires	124
when should i pay my pg&e bill	8
if my card was stolen, where do i report it	99
i need to know bank of america's routing	107
how much is the interest rate on my home equity loan	59
does brooklyn have good italian restaurants	103
i need you to turn the tv on now	113
how long does it usually take for a new credit card to come	97
what kind of sockets do the us use	87
what is tuesday's calendar like	12
tell me why my card was declined	18
tell me something interesting about elephants	46
i need you to pair with my phone please	116
add what i am listening to to my road trip playlist	136
where is the nearest gas station	36
did i spend too much dough on donuts last week	115
i prefer to be called jason	24
how do i make changes to my insurance policy	58
put laundry on my chore list	127
do i need any vaccines before traveling to brazil	138
please initiate a phone call to my boss	65
i am going away and need to rent a car	17
how should i rollover my 401k	106
i really must rent a car out of sky harbor airport from the 3rd to the 5th of february	17
i'm out of toilet paper so will you put that on my shopping list	112
remind me to check the steak	95
where is the closest target	36
scrap	15
place a hold on my chase money market market account at once	45
what are you suppose to do with a 401k rollover when getting a new job	106
let's skip over this song and listen to the next tune instead	75
how long since i swapped oil	63
please call an uber for me	135
add song to my hype playlist	136
everything needs ordered off my list	80
help me change my account	20
could a hotel be booked for me in afghanistan at the zoo for the 10th to the 15th	10
make me a reservation for 5 people at village tavern for the calloways	101
how much gas do i need to get to buffalo	47
where i can use credit card points	93
can you flip a coin i pick heads	43
find step by step instructions on how to change my oil	78
what do you want to call me	137
what questions can you answer	142
what kind of questions can you answer	142
please cancel my reservation at red lobster for 6	16
how long do i have to pay that bill	8
i want know about carry-on for frontier	19
are there 8pm tables available at texas roadhouse	101
i need help with my 401k rollover because i just got a new job	106
i want to hear anything you have that's funny	118
tell me when my credit card from visa expires please	40
will you start a timer for me	122
don't sync with my phone	116
you have my sincere gratitude	120
you can remove the wedding from my calendar for march 12, 2019	13
what's london's timezone	123
do you know if i can use pepper and not salt	55
send a text to joe	119
what do you think the purpose of life is	68
what do i need to do	126
how do i check my rewards for my old navy card	104
is there a reason my card was declined	18
whats the reward balance for my visa	104
i'd like to make an appointment to get my oil changed	108
suggest a few local eateries in mid price range	103
are there any ubers available for two people i need it to go to the stadium on grand	135
do i have anything on my todo list	126
whats the name of this song	144
purchase me the kyrie 4s	80
book uber from here to downtown	135
what's the carry on policy for delta	19
i'd like to confirm the 2:00 reservation for friday	26
have the riots in france triggered any alerts for people traveling to there	132
tell me why i get an error logging in to my bank account	1
what time am i meeting john	70
help me find somewhere to schedule a check up on my car's tires	108
how can i change your response language	22
what is the amount of pto have i used	91
i need to know the pin number to my card	85
spell doctor	114
make a quarterly payment on my life insurance premium	83
how much money is in all of my bank accounts	6
what's the due date for spectrum's bill	8
what appointments do i have tomorrow after 1:00pm	12
you were made where	145
will ecuador require proof of any shots for me to go there	138
are the ratings for yardhouse good	102
is my credit good enough to get a new card	30
how do i make chicken alfredo	92
can i hear the song that starts out doo doo doo	86
my card got dropped in the shredded and i need it replaced	32
where's my credit score	30
tell carl that he sucks	119
what is tuesday like on my calendar	12
should i go to okinawa, does it require an international visa	61
i need a timer set please	122
can you tell me what my calendar is like for thursday the 14th	12
what's my interest rate with my capital one account	59
can you inform if boston restaurant has good reviews	102
check if the doors are locked	113
set an alarm for 05:00 and one for 16:00	2
how many times do i get paid in march	84
when is it time for a tire change	124
what day were you born	52
do you know my health benefits	57
change over to the female voice	20
this was a nice chat	49
where is my cellphone	41
see ya!	49
i want to set up direct deposit to my charles schwab account	35
i don't have an answer for that	66
i need an uber ride to come and pick me up now at work	135
my card has a burn on it	32
is there anyway, i can report a suspicious activity on my citi card	98
change over to whisper mode	146
i want to go to china but am not sure if i need an international visa	61
remind me to wash the dog, put on list of things to do	127
where do i find my w-2 form	139
my phone is lost and i need help finding it	41
tell me when my credit card expires	40
what music is this	144
how is dim sum at legend	102
how do i go to whisper mode	146
will i be charged if i use my card in china	60
move two hundred dollars to my chase savings account to my wells fargo checking account	130
how would i apply for an american express	73
read my shopping list	111
for pasta primavera, what ingredients will i use	56
i would like to know when is the next holiday here	74
is anything happening on march 4th 2019	12
i want the volume at level 4	25
i will be telling my bank of my upcoming trip to spain	133
can i put in a pto request for may 1 to may 5	89
does south korea require an international visa	61
read me my meeting schedule	70
i'd like the lights in the garage to be turned on	113
in french, how do i say, see you later	131
i need a tutorial to learn how to change my oil, please	78
can i start calling you dave	21
tell me your thoughts about the meaning of life	68
send 100 dollars from my vanguard money market to my wells fargo savings	130
i need to find a good way to make chicken soup	92
what time is it over in pacific time	121
please help me in finding my phone	41
message carl, you suck	119
how do i find out when my visa bill is due	8
can you please make an appointment for me to get my tires checked out	108
can you tell me what the limit is on my capital one card	28
tell me where you were created	145
is my tire pressure good	125
not happening	76
what items do i have on my amex card this month	129
pay my dte bill from my checking account please	83
how many days of vacation do i have saved	88
what do you do with your free time	141
what are some ways to raise my credit score	53
either i am not sure	66
no, that is not correct	76
what is the wait like at apple bees	51
track the status of my purchase	82
what is the date that my visa card expires	40
what would you suggest having for dinner	67
i would love to find a few vegan restaurants in back bay	103
how is my tire pressure	125
i want to hear that again	96
what's the status on my vacation approval	90
now i'd like for you to return to the original settings	100
can you please update the status of flight dl123	42
who do you say you work for	147
where should we eat tonight	103
i want to make pork barbque but do no know how	92
what is my maurices card's rewards balance	104
give me information on grub burger reservations	0
can you arrange a meeting for 3:00 on wednesday	109
where are the best places to eat	103
let me know how to make a vacation request	89
what's my visa cards balance for rewards	104
please set an alarm for me	2
change your language setting to spanish	22
let me know chase's routing number	107
please set a meeting with nancy at 4 pm	109
tell me the least i can pay	71
how do i get to the bowling alley by foot	36
i need to know if i can put a pto request in for march 10 to march 12	89
for going to that country, do i need a visa	61
what is the total number of pints in two quarts	69
i want to change your name to sarah	21
what is the name of the insurance plan i am enrolled in	57
what sort of electrical plug do they use in mainland europe	87
apple cider has been in my fridge for four months so can i still drink it	44
where do i go to get private client account's interest rate	59
what date is the next payday	84
i need you to pair with my phone	116
schedule me an appointment to get my tires checked out	108
should i get an internation visa to go to switzerland	61
can you now please go back to the original settings	100
i enjoyed our talk, bye	49
how much do my bills cost this month	7
could you book me a hotel in afghanistan at the zoo for the 10th to the 15th	10
would you please increase the speaker volume	25
how healthy is shepard's pie	77
how much is my bill for capital one	7
how many ml's are in a gallon	69
how much interest am i getting percentage wise from chase	59
put we are the champions to my running playlist	136
is it necessary to get a shot for travel to india	138
what activities do you enjoy	141
when are my tires due for changing	124
clear my to do list	127
can you put the currently playing track on my zen playlist	136
what are the things that i wanted to keep in mind	94
is chocolate bad for you or good for you	77
is an international visa needed to go to cyprus	61
how long is it to ann arbor by bus	37
how's my gas mileage while driving through a city	72
do i have any meetings on my schedule today	70
what are some good southern bbq restaurants in nashville	103
is it possible to make a reservation at sushi king in virginia beach	0
how do i go about applying for a macy's credit card	73
see if all the doors are locked	113
how do i switch to a new insurance plan	58
do you mind if i ask your name	143
how many calories are in a ghirardelli sea salt caramel candy	14
can you tell me the number of ounces in a quart	69
i need a block placed right away on my joint checking account	45
set a reminder to pay my taxes	95
restore factory settings	100
what are united's carry-on rules	19
what type of socker conveters do i need in africa	87
what is my schedule like today, any meetings with dan	70
what is there to do in craberra	134
who is your boss by the way	147
what location is this	31
please help me make a request for vacation	89
book a flight from philadelphia to atlanta on june 5th and returning on june 8th	9
what is the name you would use for me	137
set 60 minutes for oven please	122
i want to report fraudulent activity on my quicksilver card	98
set an alarm for me please	2
how do i get my rewards from my visa card	93
how long does it take to make pho	27
hey how old are you	52
where do i locate my routing number for my premium checking account	107
i'd like to cancel my reservation for 5 at hoss's steak house	16
can you get me a car rental for march 13th to 15th in nyc, and i'd like a convertible if possible	17
how much do i have to pay for my shell gas card bill	7
can you tell me my visa's reward balance	104
please call gusto handcrafted pasta & pizza and ask them about the status of my reservation for 6:30 pm	26
is today monday	33
please talk a bit faster	23
what different pets do you have	38
don't let me forget to check the steak	95
show all purchases of video games	129
please flip coin	43
is it ok to use ketchup instead of mustard	55
i no longer want my reservation for 5 at the loft cancel it please	16
what are some good mexican restaurants in indianapolis	103
i'd like to know if my capital one credit card have international transaction fees	60
i need to know how to change my oil and what kind of oil for a 2007 trailblazer	78
i ran out of checks and need more ordered	81
what is the minimum payment for comcast	71
how do i get to the train station by bus	36
when do i need to pay my car insurance bill by	8
what is my gymboree card's rewards balance	104
how does my name appear	137
when is it time to change your oil	79
how are the reviews for pasta at assagios	102
how long do i need to cook roast for	27
you are not wrong about that	149
what was the temperature yesterday	140
what's the time of arrival on my new credit card	97
what was the date of my last car service	63
how many vacation days do i have at my disposal	88
give me a cool fact about seattle	46
do i have any meetings coming up with dan	70
do i have graham crackers on my shopping list if not please add it	112
please turn on the hallway lights	113
can i ask you all different types of questions	142
please put wash the dog on my list of things to do	127
what is the amount i owe on my phone	7
put on bended knee on my reflection playlist	136
can you play the song amazing grace and it goes like this, amazing grace how sweet the sound	86
what's the amount due on my vet and vehicle registration bills	7
how do i set up direct deposit for my bank of america account	35
help me get my paycheck set up for direct deposit to my chase account	35
what is the meaning of fascism	34
how do i convert a cup to ml	69
go to the credit card site and check if my application has gone through	3
what do i need in order to jump start my car	62
when do i need to change my oil next	79
i know that the statement is true	149
which was my insurance plan again	57
i need to know how to say hello in france	131
let me call mark	65
can you tell me how to jump start a car	62
what time is it now in michigan	121
how can i rent a car in las vegas	17
hey, have you approved my vacation time yet	90
is it possible for you to schedule a meeting for 3:00 on wednesday	109
how much do i need to pay in tax	117
who should i apply for a credit card for	73
if i am in tulsa, will i get charged extra if i use my card	60
please tell me the reason for the hold on my bb&t account	1
would you tell me how to say goodbye in france	131
what number of pto days do i have left	88
can you multiply 45 by 23	11
what is the weather outside	140
can you tell me, what is the meaning of life	68
where can i locate the routing number for the bank i bank with	107
i lost my card, how do i report it	99
what should i get to make the jamaican patties	56
i owe you one	120
can you add apples to my shopping list if they aren't already on there	112
tell me how to change my policy	58
book a reservation for 3 at xenophobe under the name zebee	101
what information do i need to direct deposit my paycheck	35
i would like to try and confirm that i have a reservation at applebee's for kristen	26
i couldn't say either could be possible	66
i would like to try and confirm that i have a reservation at longhorn for justin	26
what all can i ask you	142
great western bank's login screen tells me i'm locked out but not why	1
what are the pets you have	38
what time is it in the pacific standard time	121
on my citi card, the one that ends 1234, what's the apr	4
how long should i cook roast for	27
calculate the amount of gas i currently have	47
i need to change my insurance policy, how	58
i want you to go back to factory settings	100
what would wells fargo use as routing	107
is it time for a tire change	124
schedule my meeting with jim at 3pm	109
can you please freeze my account	45
can i hear the beatles	86
i don't know the anwser	66
what is the correct spelling of the word: dessert	114
what is the rate for 500 cad in usd	39
have a good day	49
i am in downtown austin where is the nearest airport	36
what will i need to make lasagna	56
what is the amount of calories that scrambled eggs has	14
how long would it take to get to chicago by bus	37
how are the fried chicken at zippys	102
i can't figure out why my card was declined at target	18
book a motel in uptown from march 3 to march 4	10
how can i build up my credit score	53
what are some exciting things that are a must do for tourists visiting sedona	134
can you tell me what my federal tax burden is	117
where you from	145
how many points have i earned with my chase card	104
how can i make a change to my credit limit	29
that's a yes	149
take out of my checking 400 dollars and put it into my emergency savings account	130
what's the forecast for the day	140
tell me how to spell malignant	114
can i order new checks since i am out	81
let me know what today's date is	33
does denmark use different sockets	87
if i lost my card how do i report it	99
why was my card declined just now when i tried to buy a jeep at carmax	18
i want to pay my cable bill directly from my checking account	83
can you tell me how much i need to pay on my bills this month	7
let me know when you were made	145
yearly salary	54
i need to quick dinner suggestions	67
could my 401k be rolled over	106
i need to set up a reminder for myself	95
place an order for bread	80
turn on the tv please	113
what kind of fuel should i put in my car	48
i need to know the amount of my income	54
what kind of traffic is on hwy 1 going to the downtown area right now	128
what's my yearly income	54
set all doors to locked	113
do you have any ideas on the meaning of life	68
please change the language	22
what's the wait like at chima brazilian steakhouse at this time	51
does my todo list have vacuuming on it	126
i am camile	24
have i been spending excessively on donuts recently	115
confirm four for my reservation at fiji	26
how many calories are in oranges	14
tell me why my card was declined at auto zone, why	18
set my alarm for five tomorrow morning, please	2
i would like to know if i can put a pto request in for march 19 to march 20	89
how do i set up direct deposit for my cefcu account	35
i need to know how many pto days are left	88
get my income amount for me	54
do i have enough gas to take me home	47
change to a different accent	20
please tell me the address of my current location	31
do you know my credit rating number	30
how did my bank account is frozen	1
how much is my xfinity cable bill	7
does mexico have any travel alerts i should know about	132
i am going to spain in the future and my bank needs to know this information	133
i would like to change my credit limit	29
add this song to travel	136
what's my total income	54
invalid	76
i want to eat mediterranean fare with at least four stars, near me	103
let me hear the song sympathy for the devil	86
what are the time zones of russia	123
how many miles does this car get per gallon	72
i need to know how many teaspoons are equivalent to two tablesppons	69
does bellagio allow you to do reservations	0
change the language to english	22
define ambivalence for me please	34
i want to put thank you on my playlist called relaxing jams	136
what are your hobbies	141
when am i boarding my flight	42
what's my current credit rating	30
when will my card go rotten	40
how much is 100 dollars in euros	39
what are you capable of doing and answering	142
is my todo list free	126
schedule an appointment for a tire check for me	108
i wanna know if my capital one credit card have international transaction fees	60
i want to know what trenchant means	34
