go ahead and talk faster now	23
no, that is fake	76
how much do i make in a year	54
can you tell me the nutrional info of a big mac	77
which insurance do i have	57
where should i look for my w-2	139
what kinds of taxes am i facing	117
do you work for a different employer	147
can you add laundry to my to do list	127
order all items on the list	80
does going to taiwan require me to get an international visa	61
appreciated	120
i want to call mark	65
set an alarm for four thirty tomorrow, please	2
how much air pressure is in my tires	125
what's the least i can pay towards this bill	71
how do i set up direct deposit for my first national account	35
is france safe to travel to	132
what do you like to do in your free time	141
in a fried egg, how many calories are there	14
what place were you actually born at	145
can you tell the temperature it will tomorrow	140
whats the procedure to cancel it	15
what does indignation mean	34
can you tell me how much pto have i use	91
how many vacation days have i saved up	88
how is doctor spelled	114
i'd like direct deposit to my chase bank account	35
can you place a stop on my account	45
please put a block on my regions account immediately	45
how do i report a stolen card	99
can i hear the song after this one	75
i need your accent to be changed	20
cash in my credit card points	93
you could tell me if you were real	5
do you have a cat or a dog	38
look up uber to downtown	135
what kind of meal should i eat from thailand	67
looks like my card is being used by someone else, report it	98
tell me my name the way its saved	137
i would like to know more about getting a new credit card	73
what plan am i paying for	57
is it safe to travel to mexico	132
when is my flight going to arrive	42
do you work for another person	147
how's the traffic this morning	128
where is the nearest walmart	36
i hope i have enough money in my chase account to buy new clothes	6
please go ahead and flip a coin	43
tell me when to next change my tires	124
i need to know my credit's limit	28
give me my credit limit	28
i need your volume increased	25
hey what's up	50
let's try whisper mode	146
i need to know the date it will be 4 days from now	33
i need to obtain and uber	135
i need to know is traveling to france safe	132
do you have any of the beatles music	86
who were you created by	148
what kind of gas does my car need	48
what plugs are in england	87
when's the next time i get paid	84
i need to know today's forecast	140
i need to order new checks because i am all out	81
please tell me all the purchases on my hy-vee card for this statement period	129
play the song that goes like i like to move it, move it	86
what is the best thing for me to do to improve my credit score quickly	53
find me someone who can deal with my car's illuminated check engine light	108
i'm not sure if watermelon is on my shopping list, but if it isn't can you put it on there	112
i need my pin number for my bank of america account and i can't remember it	85
do i need to get any shots before i go to brazil	138
stop please	15
i need to make a reservation to long horn's, can i	0
are there any travel alerts for mountain view	132
change your name to fred	21
text mom saying happy birthday	119
who do i contact for a w2 form	139
is there a wait time at bjs right now	51
since i ran out , order more bread	80
are you one of my employees	147
what are some good vegan restaurants in broadripple	103
what is the schedule for my next oil change	79
what kind of questions can i ask the ai	142
remind me to get an oil change	95
pay my monthy mortgage payment	83
my vacation to spain is coming up and i need my bank to know	133
please roll this 8 sided dice	105
what do i do if my luggage is lost	64
my card was declined at mcdonald's and i want to know why	18
please define institutional racism	34
i'd like to be out of whisper mode	146
can you suggest some of the most popular travel destination	134
i need to know what day i need to pay my water bill	8
what if any meetings do i have today	70
affirmitive	149
how many calories are in cake	14
do i have any meetings today between 9 and 10:15	70
what is the time frame for receiving a new credit card if my original one gets lost	97
what time is in over there in pacific standard time	121
can you help me switch to a new insurance plan	58
what is your name by chance	143
please revert to the original settings	100
help me book a place to stay from may 2 to may 4 in tampa	10
cancel my reservation at osteria for our party	16
how much is usd vs cad	39
can you cancel my todo list please	127
what type of outlets do they have in the uk	87
can i find my w-2 online	139
absolutely not	76
do you know what my name is	137
what are the possible reasons behind frozen bank account	1
use my boa account to pay the cable bill	83
i am in the mood to listen to mack the knife	86
help me find some new dinner recipes	67
tell me how to spell doctor	114
please talk faster	23
find the favorite destination for traveling this year	134
do you know the apr on my chase credit card	4
how many paypal transactions did i have last week	129
i ordered new sheets online when will they arrive	82
can you check if my mastercard application has been reviewed yet	3
i need to know the name of my current location for the tow truck	31
engage whisper mode	146
please give me a list of the ingredients contained in chocolate cupcakes	56
i was in target about to buy a chair when my card got declined	18
when was the last time i took my car in	63
do you think arizona has plenty of bike routes	134
i would like to know if you are a robot	5
what company is responsible for your design	148
i am trying to find out when is the next payday	84
add wash the dog to my list of things to do	127
when do i need to pay my dte energy bill	8
call me an uber please, and make it for four people to go downtown	135
i need you to schedule an uber pickup for me and three other people at 7pm to go to abe's pizza	135
repeat that for me	96
how is sushi at jiro	102
list a few pizza places that have seating near my current location	103
speed up your rate of speech	23
send from my bbc money market to my t rowe price money market seven thousand dollars	130
i'd like to share my location with stephanie	110
how much pto have i used	91
what is walker bank paying me in interest on my account	59
please add this song to my morning job playlist	136
i want to know when is the next holiday here	74
am i cleared to miss work for vacation	90
please change your response language to english	22
what shots are required to visit australia	138
is the apr on my card that ends 1234 what it should be based on my credit score	4
tell me the routing number for bluebird	107
what do i have going on for 12/03/2019	12
i want you to read my reminder list to me	94
please speak to me quicker from now on	23
i need to know how long it will take me to get to the bank	37
i need to make a quick decision, so roll a dice!	105
is there a routing number for wells fargo	107
is rice bad after 3 days in fridge	44
do i have anything scheduled on my calendar for next tuesday	12
what place were you born	145
what time is my meeting with fred scheduled for	70
how long can i keep pork in the freezer for before it gets freezer burnt	44
i call tails and you call heads on this coin flip i need you to do	43
i want to get new insurance	58
how far along is my credit card application	3
tell me how health chocolate is	77
how should i spell malignant	114
how long should i expect to wait for my replacement credit card	97
let me know what date it will be in 3 days	33
can you teach me to change my oil	78
do i have enough fuel to get to buffalo	47
i want to start calling you adam	21
look up the exchange rate between dollars and euros	39
is my gas tank full or empty	47
should i get shots if i'm going to go to thailand	138
what is the correct amount of ounces in a pound	69
how long since my oil had a refresh	63
please pair my phone	116
steve needs to know my location	110
how much money did i spent on grocery recently	115
switch language for me	22
how long do i need to cook chili for	27
tell me how to make a vacation request	89
what steps do i need to take to jump start my car	62
i'd like to know your name	143
spell: dessert	114
what are the top 10 ways to build my credit score	53
do i have plans on 12/03/2019	12
do i need to get any shots before volunteering in the congo	138
please assist me in linking my chase account to direct deposit for my paycheck	35
can you tell me my credit rating	30
are you an actual human	5
which subjects can you tell me about	142
explain how do i get new insurance	58
book room for me and her under the name kendra	101
do you own any animals	38
please talk slower for me if you can	23
if i travel there, do i need a visa	61
i need to be reminded	95
what does it look like i will be paying in federal taxes this year	117
where do you hale from	145
thanks for the assist	120
speak german	22
what can i do in hong kong	134
give me a cool fact about potatoes	46
tell my something funny	118
i need for you to skip this song	75
is my order at the delivery address	82
do i have any meetings on my calendar today	70
thank you for the chat, goodbye	49
is mcdonalds busy around 9	51
can you slow down your rate of speech	23
what transactions did i put on my visa last month	129
please pay my utility bill from my wells fargo checking account	83
my card isn't working because its destroyed	32
what's the recommended cooking time for steak	27
can you move my money to my savings	130
what is the reservation policy for spago in beverly hills	0
give me a good recipe for chicken parmesan	92
tell me how to say hello in chile	131
complete a roll on a 4 sided dice	105
give me location for tourist destination in bangkok	134
i need know know the reward balance for my visa	104
i need to know my phone's location	41
you can remove the play date from my calendar for feb 18, 2019	13
can you answer all types of questions	142
what are my health benefits like	57
do i need to get any shots before travelling to australia	138
is there an uber going to downtown	135
what's the mpg rating on my car	72
i need your help finding my lost phone	41
i want you to skip this song	75
i wonder if i have enough money in my chase account for a bike	6
you can call me jason	24
can you tell me the due date for the water bill	8
will you please read the things on my shopping list	111
i would like to learn to make cookies	92
needing you to play the next song	75
can you tell me how good my card's apr is	4
when do i get my paycheck	84
what is a good apr	4
i am glad that you did that	120
when should my car's tires be changed	124
i'll use what ingredients for lasagna	56
please let me review all items on my mastercard from this billing period	129
any recommendations for a greek dinner	67
i'd like to know how to make changes for my insurance policy	58
my disney visa card is stolen	99
how much do i owe on all of my bills	7
put whisper mode on	146
what transactions have i made in the last few weeks	129
repeat my to do list	126
add swimming to my calendar today	13
do you think i have enough money in my chase account for a new pair of sneakers	6
recipe for beef stroganoff	92
how do i get to the movie theater by bus	36
provide assistance on what to do to make a vacation request	89
command cancel	15
what pets are with you	38
is raw carrot healthy to eat	77
what recreational activities do you enjoy	141
i really need to get a volkswagen car rental for march 5th to march 8th in phoenix	17
my name is jason	24
tell me the calorie content of frosted flakes	14
a volume of 4 is ideal please	25
transfer ten dollars from my wells fargo account to my bank of america account	130
please make the timer for cooking for for 2 hours	122
what should i do if i lost my luggage	64
how long to seattle on a bus	37
give me the date	33
i need to know the credit limit	28
what steps can i take to improve my credit score	53
can you tell me what a septuagenarian is	34
can you initiate a block on my bank of america checking asap	45
can you find me a round trip flight from denver international to new york international on the 3rd through the 7th	9
tell me how i know when to pay my chase bill	8
which kinds of info are you familiar with	142
who conjured you	148
can i make reservations at grub burger	0
would you translate a phrase into mandarin for me	131
how long will the trip to portland be	37
goodnight	49
what date will it be 8 days from now	33
i am now out of checks, how do i order new ones	81
what is the amount i owe to clay electric	7
what kind of ingredients go into the chicken a la king	56
what hour is it in london	121
how many gallons is 50 liters	69
send a text to mom saying i'm on my way	119
i need a w2 form, how do i get one	139
what is the interest rate at pnc	59
i want to change the pin number on my credit union account	85
do you have any animals	38
i would like to have my credit increased to 5000 dollars	29
how safe is visiting canada this week	132
will i be charged if i use my card in vietnam	60
at what point will the review of my credit card application be completed	3
how much did i spend on grocery shopping recently	115
would you talk a bit faster instead	23
what is the nutrition information for shrimp scampi	77
hi, ai	50
tell me the exchange rate between here and country b	39
i enjoyed our talk, goodbye	49
how can i learn how to use direct deposit	35
what's the status of my medical leave	90
what are your hobbies siri	141
does my visa have international transaction fees	60
secure the doors	113
does spago in beverly hills allow customers to make reservations	0
i feel like going out for sushi tonight who in the area serves good sushi	103
how long has it been since i was paid	84
is it okay to switch apples for grapes	55
how much did i spend on shcool due last year	115
when should i change my tires	124
can you show me how to report a lost card	99
call contact aj	65
which holiday do we celebrate next	74
am i ready for an oil change soon	79
my card was in my pocket and bent	32
what is the balance in my pnc account	6
what's my latest credit score	30
how long is the wait at applebee's tonight	51
how do you show my name	137
help! i'm a victim of credit card fraud!	98
what do i have to do	126
i want to hear my reminder list	94
is cooked chicken still good after being refrigerated for two weeks	44
what are the cuban plugs like	87
was my order shipped here	82
i enjoyed speaking with you	49
can i make reservations at spago in beverly hills	0
was is my salary	54
can you suggest a mexican dish	67
please roll a dice	105
set my alarm for eight tomorrow, please	2
what is my interest rate for my scotiabank account	59
tell me what my name is	137
what is the least i can pay towards my car bill	71
are there any travel alerts for juarez	132
turn down your volume please	25
add song to media playlist	136
no, that's not it	76
help me book a car rental in chicago for april 1st to 3rd get me an suv if possible	17
explain what my credit limit is	28
please order an iphone7 for me	80
what animals await you at home	38
jason is my name	24
that makes sense as well	149
could you tell me what kind of money i've recently spent	115
what type of pet is in your home	38
the credit limit i have needs to be changed	29
what's my credit limit for my visa card	28
will you start calling me chaz	24
where can i locate the ally routing number	107
redeem credit card points	93
i'm wanting you to flip a coin	43
add to my list of things to do: wash the dog	127
i lost a card and i need to report it	99
possibly either one	66
set the timer for 10 minutes	122
what are my coordinates	31
my card is lost and i need to know how to report it	99
put one hundred and seventy five bucks in my wells fargo checking account from my citibank savings account	130
where can i locate the pnc account's interest rate	59
where is your favorite restaurant to eat	103
how many pto days are available	88
i need to know what dominate means	34
can you remove this event from my calendar, please	13
was my order brought here	82
please delete the items on my to do list	127
how many days before milk expire	44
where do i report fraud on my credit card	98
what is the procedure if i lost my luggage	64
show me a plan to help my credit score rating	53
can i change you name to gretchen	21
make an alarm for one and two in the morning	2
i need quiet; use whisper	146
my card was stolen, how do i report this	99
is rice good for me	77
can i make an appointment to get my tires checked	108
what do i owe on telephone and cable bill	7
flip the coin ai	43
hey how's it going	50
how would i go about spelling malignant	114
how is the steamed fish at harbor village	102
please play the song that goes like america the beautiful	86
are there any necessary shots required before travel to thailand	138
i need you to check the air levels in my tires and let me know if i have enough in them	125
define antagonist for me please	34
when will my credit card application be reviewed	3
what is the total of my repair bill	7
will you check to see if i am still reserved for 6:30 pm at gusto handcrafted pasta & pizza	26
what will be the weather tomorrow	140
set me an alarm now	2
you have my gratitude	120
set a reminder for me to request time off work around the holidays	95
what type of electrical plug do they use in spain	87
i need an idea for a french dinner	67
what is the apr on my citibank card	4
what day of the week are we on	33
i'd like to know the meaning of life	68
how many tablespoons are there in half of a cup	69
you shall address me as nick	24
this was fun, see you around bye	49
what are the steps required for making a vacation request	89
i need a roll on a 6 sided dice	105
flip a coin now	43
disconnect sync from my phone	116
please skip this song for me	75
i need alarm for both 4am and 7am	2
i want to pay a bill	83
put song in springtime playlist	136
what country are you from	145
can you slow down the rate at which you talk	23
i need to know the weather	140
i wanted to remember somethings, what was it	94
when did the oil get changed	63
tell me my reminder list	94
i'd like to know how changes are made to my insurance policy	58
british columbia can be found in what timezone	123
what is the amount of time i can request off in the coming year	88
help me set a timer please	122
your accent needs to be changed	20
can you tell me the ingredients used in pasta sauce	56
can i rent a car from dfw airport from march 1st to march 8th	17
who is your manufacturer	148
does the uk require a travel visa	61
what place were you made at	145
please roll that dice	105
please schedule a meeting with kim at 10 am	109
confirm my johnny rockets reservation for this evening	26
how many miles will i get for one gallon on this car	72
i want to report fraudulent activity on my mastercard	98
location currently, where	31
add a doctor's appointment to my calendar for friday	13
what does my running list of stuff to do list	94
find list of ingredients i would need to bake a funnel cake	56
i would like to find out how to cash out cred card points	93
how much money do i make a week	54
i don't want my current pin for my wells account anymore	85
reset to factory settings	100
how much do i pay in taxes every year	117
10 minutes is what the timer should be set at	122
good morning, ai	50
are there any travel alerts for seattle	132
what is the amount of vacation day i have used	91
do my tires have enough air in them	125
what is my tax burden	117
can you make a reservation in tampa from may 2 to may 4	10
will maggianos in charlotte allow me to make a reservation	0
name this song	144
way to change car oil	78
gas type needed for this car	48
my credit limit needs to me changed	29
can i afford a new tv from my savings account	6
i want you to know it's a true statement	149
is there a due date on the bill	8
when would it be wise for me to swap out my tires	124
how long do i need to cook beef stew for	27
has my request for vacation time been approved	90
this was a nice conversation	49
in what timezone is atlanta located	123
i need to switch accounts	20
at what time is my flight scheduled to land	42
how long before i need to replace my tires	124
is it possible to do a reservation at the bellagio	0
who do i contact for lost luggage	64
i am enrolled in an insurance plan and need to know what it is	57
can we call mark	65
can you give me instructions on how to make alfredo	92
can you tell me how much air are in my car tires	125
what's the minimum payment on my bill	71
nice song what is it	144
pull up my credit card application's current status	3
tell me a fun fact about the moon landing	46
i need your assistance to solve this math problem	11
what is the route to take to report a lost card	99
convert 2 cups to liters	69
i want to update my pin number on my bank of america account	85
i would like you to suggest a chinese dish	67
i would like to report a fraud on my wells fargo card, please	98
would it be ok if i have pepper and not salt	55
negatory	76
what kind of miles per gallon do i get while driving through a city	72
cancel my reservation for 5 at the loft	16
how much gas do i have	47
i have no checks and need to order new checks	81
how do i get a w2 form	139
what kind of fuel do i need to put in my car	48
will you please do the male british accent	20
i think dan scheduled a meeting today with me, can you double check please	70
undo my reservation for 5 at the loft	16
help me solve this math equation	11
could you translate this into chinese for me, please	131
arrange a meeting room for 9am on friday	109
what you age on your last birthday	52
whare the ingredients for the stir fry	56
i am not sure if i have enough money in my chase account to buy a new dress	6
please put a hold on my retirement account right now	45
please turn your volume up	25
set up a 52 minute timer	122
certainly not	76
give my gps location to jason	110
i need a flight from the 3rd to the 7th round rip from denver international to new york international	9
how many points have i earned with my amex card	104
could you speed up your speech	23
do i have soda on my shopping list if not please add it	112
where can i apply for a black amex card	73
tell me how i can apply for a chase credit card	73
my car's tires are due to be looked at, can you help me get an appointment for that	108
can you order an iphone7 for me with two-day free delivery	80
could you let me know how many pto days do i have left	88
let lisa know where i am now	110
can you tell me the drive time to the nearest gas station	37
i need to know when my credit card is going to expire	40
lowest amount for cable bill	71
my card was rejected at the zoo, could you tell me why	18
is there a holiday this month	74
what date will it be 7 days from now	33
is it possible to add grapes to my shopping list if they aren't on there already	112
should i cook this for a long time	27
are you a robot	5
can my 401k rollover or not	106
what is my card's apr	4
how many tablespoons is 5 teaspoons	69
what's my credit rating right now	30
configure this to factory settings	100
someone is charging my card for playstations, and it's not me! what do i do!	98
what is our purpose	68
what is seventeen plus three	11
i need to add iep meeting to my calendar on april 15th	13
order dog food from walmart	80
would it be a problem to sub chips instead of fries	55
how many vacation days have i accumulated	88
what is the process of reporting a lost card	99
was my last transaction at walmart	129
help me buy a black iphone7	80
i don't need my reservation for 5 at the loft please cancel it	16
i ordered some new speakers, so when will they get here	82
what is that song called	144
i'd like to increase my credit limit	29
i have a vacation request that i need made	89
please check my tires and let me know if i have sufficient air in them	125
order all of my shopping list	80
how many gallons of gas are in my car	47
how long do i put sugar cookies in for	27
what hobbies do you have alexa	141
what is the process to set up a meeting	109
tell me where i left my phone	41
what kind of interest can i expect with my chase account	59
tell me a cool fact about reno	46
rescind	15
can you help me add the song i listen to to my clutch playlist	136
how bad is traffic on the way into oakville right now	128
please call mark	65
can't say	66
please turn the tv on	113
how many ounces in a liter	69
relate to me what my credit score is	30
i need to let my bank know i will be in america from april to may	133
what's the exchange rate between country a and country b	39
i keep trying to figure out if i have enough money in my chase account to purchase a new set of tires	6
how long should i cook country fried potatoes for	27
tell me how the traffic is on rt 7 to the airport today	128
how long is the wait at chipotle right now	51
could that be repeated	96
stop it	15
are you a human being or a computer	5
what is the current status of my credit card application	3
will my 401k carryover	106
i want your name to be henry	21
let carl know that he sucks	119
how should i go about improving my credit score	53
can you find me a flight from denver international to new york international on the 4th for under 700 dollars	9
can you play the song that goes doo doo doo	86
who can jump off my dead car battery	62
malignant is spelled how exactly	114
please call felicity	65
i need to know what my limit is on my american express card	28
i was wondering about the vacation time you said you'll approve	90
the ac, could you tell me the temperature	113
what insurance do i have	57
i need to know my tax rate	117
what to do in minneapolis	134
your name is	143
i am curious to know if you are a bot	5
can you remove that event from my calendar, please	13
how many years have you been living	52
how much is my salary	54
thank you for the help	120
please change your language setting to russian	22
please skip this song and go to the next one instead	75
i need a new pin on my chase account	85
what can i do to get a better credit score	53
i need to report unauthorized activity on my card	98
